artist_name,track_name,genre,lyrics
Destiny's Child,Say My Name,pop,"81 ContributorsSay My Name Lyrics[Intro: Rodney ""Darkchild"" Jerkins] (Darkchild '99)  [Chorus: Beyoncé & Destiny's Child] Say my name, say my name If no one is around you, say, ""Baby, I love you"" If you ain't runnin' game Say my name, say my name You actin' kinda shady, ain't callin' me ""baby"" Why the sudden change? Say my name, say my name If no one is around you, say, ""Baby, I love you"" If you ain't runnin' game Say my name, say my name You actin' kinda shady, ain't callin' me ""baby"" Better say my name  [Verse 1: Beyoncé] Any other day I would call, you would say ""Baby, how's your day?"" But today, it ain't the same Every other word is ""Uh-huh, yeah, okay"" Could it be that you are at the crib with another lady? If you took it there, first of all, let me say I am not the one to sit around and be played So prove yourself to me if I'm the girl that you claim Why don't you say the things that you said to me yesterday? You might also like[Pre-Chorus: Destiny's Child & Beyoncé] I know you say that I am assuming things Something's goin' down, that's the way it seems Shouldn't be no reason why you're actin' strange If nobody's holdin' you back from me 'Cause I know how you usually do Where you're sayin' everything to me times two Why can't you just tell the truth? If somebody's there then tell me who  [Chorus: Beyoncé & Destiny's Child] Say my name, say my name (Say my name, is around you) If no one is around you, say, ""Baby, I love you"" (Love you) If you ain't runnin' game Say my name, say my name (Say my name, say my name) You actin' kinda shady, ain't callin' me ""baby"" (Baby, yeah, yeah) Why the sudden change? Say my name, say my name If no one is around you, say, ""Baby, I love you"" (Ye-yeah, ye-yeah, yeah) If you ain't runnin' game (No, no, no, no, no, no) Say my name, say my name You actin' kinda shady, ain't callin' me ""baby"" Better say my name  [Verse 2: Beyoncé] What is up with this? Tell the truth, who you with? How would you like it if I came over with my clique? Don't try to change it now sayin' you gotta bounce When two seconds ago said you just got in the house It's hard to believe that you are at home by yourself When I just heard the voice, heard the voice of someone else Just this question, why do you feel you gotta lie? Gettin' caught up in your game when you cannot say my name [Pre-Chorus: Destiny's Child & Beyoncé] I know you say that I am assuming things Something's goin' down, that's the way it seems Shouldn't be no reason why you're actin' strange If nobody's holdin' you back from me 'Cause I know how you usually do Where you're sayin' everything to me times two Why can't you just tell the truth? If somebody's there then tell me who  [Chorus: Beyoncé & Destiny's Child] Say my name, say my name (Say my name) If no one is around you, say, ""Baby, I love you"" (I love you) If you ain't runnin' game Say my name, say my name (Say my name, say my name) You actin' kinda shady, ain't callin' me ""baby"" (Say my name) Why the sudden change? (Sudden change) Say my name, say my name (Say my name) If no one is around you, say, ""Baby, I love you"" (If ain't nothin' changed, oh) If you ain't runnin' game (Baby, say my name) Say my name, say my name You actin' kinda shady, ain't callin' me ""baby"" (Ooh, oh) Better say my name  [Bridge: Beyoncé & Rodney ""Darkchild"" Jerkins] Oh, yeah (Where my ladies at?) Ye-yeah, ye-yeah, yeah (Please say that, come on) Ye-yeah, ye-yeah, ye-yeah, ye-yeah (All the girls say) Ye-yeah, ye-yeah (I can't hear ya) Ye-yeah, ye-yeah, ye-yeah, ye-yeah (All the girls say) Ye-yeah, ye-yeah, ye-yeah, ye-yeah (All the girls say) Ye-yeah, ye-yeah, ye-yeah, ye-yeah Ye-yeah, ye-yeah (Break it down) Oh, woah, woah (Ye-ye-yeah) (Uh, uh-uh, DC, take it to the bridge, come on) [Pre-Chorus: Destiny's Child & Beyoncé] I know you say that I am assuming things Something's goin' down, that's the way it seems Shouldn't be no reason why you're actin' strange If nobody's holdin' you back from me 'Cause I know how you usually do Where you're sayin' everything to me times two Why can't you just tell the truth? If somebody's there then tell me who  [Chorus: Beyoncé & Destiny's Child] Say my name, say my name If no one is around you, say, ""Baby, I love you"" (If no one is around you) If you ain't runnin' game (Call me your boo) Say my name, say my name (And tell me what you love to do) You actin' kinda shady, ain't callin' me ""baby"" (Woah) Why the sudden change? Say my name, say my name If no one is around you, say, ""Baby, I love you"" (Say, ""Baby, I love you"") If you ain't runnin' game (Baby, say my name) Say my name, say my name (Say my name, say my name) You actin' kinda shady, ain't callin' me ""baby"" (Shady, baby) Better say my name Say my name, say my name If no one is around you, say, ""Baby, I love you"" (Say, ""Baby, I love you"") If you ain't runnin' game Say my name, say my name (Say my name) You actin' kinda shady, ain't callin' me ""baby"" (Say my name) Why the sudden change? (Ye-yeah, ye-yeah) Say my name, say my name (Ye-yeah, ye-yeah) If no one is around you (Ye-yeah, ye-yeah) Say, ""Baby, I love you"" (Ye-yeah, ye-yeah, ye-yeah, ye-yeah) If you ain't runnin' game (Ye-yeah, ye-yeah) Say my name, say my name (Ye-yeah, ye-yeah) You actin' kinda shady (Ye-yeah, ye-yeah) Ain't callin' me ""baby"" (Ye-yeah, ye-yeah, ye-yeah, ye-yeah) Better say my name  [Outro: Beyoncé] Thou shalt know she can't love you68Embed"
Blackstreet,No Diggity,pop,"[Intro] Yeah You know what? I like the playettes No diggity, no doubt, uh Play on, playette Play on, playette Yo, Dre, drop the verse [Verse 1: Dr. Dre] It's going down, fade to Blackstreet The homies got at me, collab' creations bump like acne No doubt, I put it down, never slouch As long as my credit can vouch, a dog couldn't catch me **** out Tell me who can stop when Dre makin' moves Attracting honeys like a magnet Giving 'em eargasms with my mellow accent Still moving this flavor With the homies Blackstreet and Teddy The original rump shakers [Verse 2: Teddy Riley] Shorty get down, good Lord Baby got 'em open all over town Strictly biz, she don't play around Cover much grounds, got game by the pound Getting paid is her forte Each and every day, true player way I can't get her out of my mind (Wow) I think about the girl all the time (Wow-wow) East side to the west side Pushin' phat rides, it's no surprise She got tricks in the stash, stacking up the cash Fast when it comes to the gas By no means average She's on when she's got to have it Baby, you're a perfect ten, I wanna get in Can I get down so I can win? [Chorus: Teddy Riley & Chauncey 'Black' Hannibal] I like the way you work it No diggity, I got to bag it up (Bag it up) I like the way you work it No diggity, I got to bag it up (Bag it up, girl) I like the way you work it No diggity, I got to bag it up (Bag it up) I like the way you work it No diggity, I got to bag it up (Get up) [Verse 3: Chauncey 'Black' Hannibal] She's got class and style Street knowledge by the pound Baby never act wild Very low-key on the profile Catchin' feelings is a no Let me tell you how it goes Herb's the word, spin's the verb Lovers, it curves, so freak what you heard Rollin' with the phatness You don't even know what the half is You've got to pay to play Just for shorty bang-bang to look your way I like the way you work it Trump tight all day, every day You're blowing my mind, maybe in time Baby, I can get you in my ride [Chorus: Teddy Riley & Chauncey 'Black' Hannibal] I like the way you work it No diggity, I got to bag it up (Bag it up) I like the way you work it No diggity, I got to bag it up (Oh, yeah) I like the way you work it No diggity, I got to bag it up (Bag it up, babe) I like the way you work it No diggity, I got to bag it up (Get up) [Break: Teddy Riley & Chauncey 'Black' Hannibal] Hey yo, hey yo, hey yo, hey yo (Hey yo, that girl looks good) Hey yo, hey yo, hey yo, hey yo (Play on, play on, play on) Hey yo, hey yo, hey yo, hey yo (You're my kind of girl) Hey yo, hey yo, hey yo, hey yo (Hey yo) [Verse 4: Queen Pen] 'Cause that's my peeps and we rolls deep Flyin' first class from New York City to Blackstreet What you know about me? Not a **** thing Cartier wooden frames sported by my shorty As for me, icy gleaming pinkie diamond ring We bes the baddest clique up on the scene Ain't you getting bored with these fake-**** broads? I shows and proves, no doubt, I been diggin' you so Please excuse if I come across rude, that's just me And that's how a playette's got to be Stay kickin' game with a capital G Ask the peoples on my block, I'm as real as can be Word is bond, faking moves never been my thing So, Teddy, pass the word to your **** Chauncy I'll be sending the call, let's say, around 3:30 Queen Pen and Blackstreet, it's no diggity (No diggity, no doubt, baby) [Chorus: Teddy Riley & Chauncey 'Black' Hannibal] I like the way you work it No diggity, I got to bag it up (Girl, you got it going on) I like the way you work it No diggity, I got to bag it up (Play on, play on, play on) (Hey yo, hey yo, hey yo, hey yo) I like the way you work it No diggity, I got to bag it up (Hey, ooh) (Hey yo, hey yo, hey yo, hey yo) I like the way you work it No diggity, I got to bag it up (Hell, yeah, babe) [Outro: Teddy Riley & Chauncey 'Black' Hannibal] Yeah, come on Becky in full effect (No doubt) Lisa in full effect (Right) Vicky in full effect (Uh-huh) Tamika in full effect (Yeah) Blaze in full effect (Right) Ain't nothin' goin' on but the rent (No doubt) Yeah, play on, playette (Play on, playette) Play on (Play on), play on (play on) 'Cause I like it (Right) No diggity, no doubt, yeah Blackstreet productions We out, we out (Right) We out, we out"
Gwen Stefani,Hollaback Girl,pop,"85 ContributorsHollaback Girl Lyrics[Intro] Uh-huh, this my shit All the girls, stomp your feet like this  [Chorus] A few times I've been around that track So it's not just gonna happen like that 'Cause I ain't no Hollaback Girl I ain't no Hollaback Girl A few times I've been around that track So it's not just gonna happen like that 'Cause I ain't no Hollaback Girl I ain't no Hollaback Girl  [Post-Chorus] Ooh, this my shit, this my shit Ooh, this my shit, this my shit Ooh, this my shit, this my shit Ooh, this my shit, this my shit  [Verse 1] I heard that you were talking shit And you didn't think that I would hear it People hear you talking like that Getting everybody fired up So I'm ready to attack, gonna lead the pack Gonna get a touchdown, gonna take you out That's right, put your pom-poms down Getting everybody fired up You might also like[Chorus] A few times I've been around that track So it's not just gonna happen like that 'Cause I ain't no Hollaback Girl I ain't no Hollaback Girl A few times I've been around that track So it's not just gonna happen like that 'Cause I ain't no Hollaback Girl I ain't no Hollaback Girl  [Post-Chorus] Ooh, this my shit, this my shit Ooh, this my shit, this my shit Ooh, this my shit, this my shit Ooh, this my shit, this my shit  [Verse 2] So that's right, dude, meet me at the bleachers No principals, no student-teachers Both of us wanna be the winner But there can only be one So I'm gonna fight, gonna give it my all Gonna make you fall, gonna sock it to you That's right, I'm the last one standing And another one bites the dust [Chorus] A few times I've been around that track So it's not just gonna happen like that 'Cause I ain't no Hollaback Girl I ain't no Hollaback Girl A few times I've been around that track So it's not just gonna happen like that 'Cause I ain't no Hollaback Girl I ain't no Hollaback Girl  [Post-Chorus] Ooh, this my shit, this my shit Ooh, this my shit, this my shit Ooh, this my shit, this my shit Ooh, this my shit, this my shit [Bridge] Let me hear you say, this shit is bananas B-A-N-A-N-A-S This shit is bananas B-A-N-A-N-A-S Again, the shit is bananas B-A-N-A-N-A-S This shit is bananas B-A-N-A-N-A-S [Chorus] A few times I've been around that track So it's not just gonna happen like that 'Cause I ain't no Hollaback Girl I ain't no Hollaback Girl A few times I've been around that track So it's not just gonna happen like that 'Cause I ain't no Hollaback Girl I ain't no Hollaback Girl  [Post-Chorus] Ooh, this my shit, this my shit Ooh, this my shit, this my shit Ooh, this my shit, this my shit Ooh, this my shit, this my shit51Embed"
Kelly Clarkson,Since U Been Gone,pop,"49 ContributorsSince U Been Gone Lyrics[Verse 1] Here's the thing, we started out friends It was cool, but it was all pretend Yeah, yeah Since you been gone  [Verse 2] You're dedicated, you took the time Wasn't long 'til I called you mine Yeah, yeah Since you been gone  [Pre-Chorus] And all you'd ever hear me say Is how I picture me with you That's all you'd ever hear me say  [Chorus] But since you been gone I can breathe for the first time I'm so movin' on, yeah, yeah Thanks to you Now I get what I want Since you been gone  [Verse 3] How can I put it? You put me on I even fell for that stupid love song Yeah, yeah Since you been gone You might also like[Pre-Chorus] How come I'd never hear you say, ""I just wanna be with you""? Guess you never felt that way  [Chorus] But since you been gone I can breathe for the first time I'm so movin' on, yeah, yeah Thanks to you Now I get, I get what I want Since you been gone  [Bridge] You had your chance, you blew it Out of sight, out of mind Shut your mouth, I just can't take it Again and again and again and again  [Chorus] Since you been gone (Since you been gone) I can breathe for the first time I'm so movin' on, yeah, yeah Thanks to you (Thanks to you) Now I get, I get what I want I can breathe for the first time I'm so movin' on, yeah, yeah Thanks to you (Thanks to you) Now I get (I get) You should know (You should know) That I get, I get what I want [Outro] Since you been gone Since you been gone Since you been gone29Embed"
Sinéad O'Connor,Nothing Compares 2 U,pop,"62 ContributorsTranslationsDeutschNothing Compares 2 U Lyrics[Verse 1] It's been seven hours and fifteen days Since you took your love away I go out every night and sleep all day Since you took your love away Since you've been gone I can do whatever I want I can see whomever I choose I can eat my dinner in a fancy restaurant But nothing, I said, nothing can take away these blues  [Chorus] 'Cause nothing compares Nothing compares to you  [Verse 2] It's been so lonely without you here Like a bird without a song Nothing can stop these lonely tears from falling Tell me, baby, where did I go wrong? I could put my arms around every boy I see But they'd only remind me of you I went to the doctor and guess what he told me, guess what he told me He said, ""Girl, you better try to have fun no matter what you do,"" but he's a fool  [Chorus] 'Cause nothing compares Nothing compares to you You might also like[Instrumental Break]  [Bridge] All the flowers that you planted, mama, in the backyard All died when you went away I know that living with you, baby, was sometimes hard But I'm willing to give it another try  [Outro] Nothing compares Nothing compares to you Nothing compares Nothing compares to you Nothing compares Nothing compares to you20Embed"
Lionel Richie,All Night Long (All Night),pop,"33 ContributorsAll Night Long (All Night) Lyrics[Intro] Da, da Da, da, oh Da Woah, oh  [Verse 1] Well, my friends, the time has come To raise the roof and have some fun Throw away the work to be done Let the music play on Everybody sing, everybody dance Lose yourself in wild romance  [Pre-Chorus 1] We're going to party, Karamu, fiesta, forever Come on and sing along We're going to party, Karamu, fiesta, forever Come on and sing along  [Chorus] All night long (All night, all night, all night) All night long (All night, all night, all night) All night long (All night, all night, all night) All night long (All night) Oh yeah (All night) See Lionel Richie LiveGet tickets as low as $42You might also like[Verse 2] People dancing all in the street See the rhythm all in their feet Life is good, wild and sweet Let the music play on Feel it in your heart and feel it in your soul Let the music take control  [Pre-Chorus 2] We're going to party, Liming, fiesta, forever Come on and sing along We're going to party, Liming, fiesta, forever Come on and sing my song  [Chorus] All night long, oh (All night, all night) All night long, yeah (All night, all night) All night long, yeah (All night, all night) All night long, ah, (All night, all night)  [Verse 3] Yeah, once you get started you can't sit down Come join the fun, it's a merry-go-round Everyone's dancing their troubles away Come join our party, see how we play [Bridge] Tam bo li de say de moi ya Yeah, Jambo, Jambo Way to parti, o we goin' Oh, jambali Tam bo li de say de moi ya Yeah, Jambo, Jambo Oh, yes We're gonna have a party, yeah, uh  [Chorus] All night long (All night, all night, all night) All night long, yeah (All night, all night) All night long (All night, all night, all night) All night long, oh (All night, all night)  [Pre-Chorus 1] We're going to party, Karamu, fiesta, forever Come on and sing along We're going to party, Karamu, fiesta, forever Come on and sing my song  [Chorus] All night long (All night, all night, all night) All night long (All night, all night, all night) All night long (All night, all night, all night) All night long (All night, all night) [Post-Chorus] All night, all night All night, all night All night, all night All night, all night All night, all night All night, all night All night, all night All night, all night  [Outro] Everyone you meet (All night) They're jamming in the street (All night) All night long (All night) Yeah, I said (All night) Everyone you meet (All night) They're jamming in the street (All night) All night long (All night, all night) Feel good, feel good (All night, all night) (All night, all night) (All night, all night) (All night, all night) (All night, all night) (All night, all night) (All night, all night) (All night, all night) (All night, all night) (All night, all night) (All night, all night) (All night, all night) (All night, all night)17Embed"
The Go-Go's,We Got The Beat,pop,"27 ContributorsWe Got the Beat Lyrics[Verse 1] See the people walking down the street Fall in line just watching all their feet They don't know where they wanna go But they're walking in time  [Chorus] They got the beat They got the beat They got the beat, yeah They got the beat  [Verse 2] All the kids just getting out of school They can't wait to hang out and be cool Hang around 'til quarter after twelve That's when they fall in line  [Chorus] They got the beat They got the beat Kids got the beat, yeah Kids got the beat  [Verse 3] Go-go music really makes us dance Doing the pony puts us in a trance Do the watusi just give us a chance That's when we fall in line See The Go-Go’s LiveGet tickets as low as $277You might also like[Chorus] 'Cause we got the beat We got the beat We got the beat, yeah We got it  [Outro] We got the beat We got the beat We got the beat Everybody get on your feet We got the beat We know you can dance to the beat We got the beat Jump back, kick round We got the beat Round and round and round  We got the beat We got the beat We got the beat We got the beat We got the beat We got the beat We got the beat We got the beat We got the beat We got the beat We got the beat We got the beat We got the beat We got the beat1Embed"
Boyz II Men,End Of The Road,pop,"48 ContributorsEnd of the Road Lyrics[Intro: Michael McCary] Girl, you know we belong together I have no time for you to be playin' with my heart like this You'll be mine forever, baby, you just see  [Verse 1: Nathan Morris] We belong together And you know that I'm right Why do you play with my heart Why do you play with my mind? Said we'd be forever Said it'd never die How could you love me and leave me And never say goodbye?  [Pre-Chorus: Wanyá Morris] When I can't sleep at night without holding you tight Girl, each time I try, I just break down and cry Pain in my head, oh, I'd rather be dead Spinnin' around and around  [Chorus: All] Although we've come to the end of the road Still, I can't let go It's unnatural, you belong to me, I belong to you Come to the end of the road Still, I can't let go It's unnatural, you belong to me, I belong to you See Boyz II Men LiveGet tickets as low as $52You might also like[Verse 2: Shawn Stockman] Girl, I know you really love me You just don't realize You've never been there before It's only your first time Maybe I'll forgive you, mmm Maybe you'll try We should be happy together Forever, you and I  [Pre-Chorus: Wanyá Morris] Will you love me again like you loved me before? This time, I want you to love me much more This time instead, just come to my bed And baby, just don't let me, don't let me down, oh  [Chorus: All, Wanyá Morris] Although we've come to the end of the road (End of the road) Still, I can't let go (The end of the road and I know I can't let go, baby) It's unnatural, you belong to me, I belong to you (I don't know what I'm gonna do) Come to the end of the road (I don't know what I'm gonna do 'cause I know I've come to the end of the road, the end of the road) Still, I can't let go (Oh my God, oh my God, help me out a little bit, baby) It's unnatural, you belong to me, I belong to you  [Interlude: Michael McCary, Shawn Stockman] Girl, I'm here for you All those times at night when you just hurt me And just ran out with that other fella Baby, I knew about it, I just didn't care You just don't understand how much I love you, do you? I'm here for you I'm not out to go out and cheat all night (Maybe I'll forgive you, baby) Just like you did, baby, but that's alright Heh, I love you anyway (Maybe you'll try) And I'm still gonna be here for you 'til my dying day, baby Right now, I'm just in so much pain, baby (We should be happy together forever) 'Cause you just won't come back to me (You and I) Will you? Just come back to me (Yeah, yeah) [Interlude: Michael McCary, All] (Lonely) Yes, baby, my heart is lonely (Lonely) My heart hurts, baby (Lonely) Yes, I feel pain too (Lonely) Baby, please  [Pre-Chorus: Wanyá Morris] This time instead, just come to my bed And baby, just don't let me down  [Chorus: All, Wanyá Morris] Although we've come to the end of the road (We've come to the end of the road) Still, I can't let go (I know I just can't let go, no) It's unnatural, you belong to me, I belong to you (No, no, no, no, no, no, no, no) (I don't know what I'm gonna do) Come to the end of the road (I don't know what I'm gonna do 'cause I know I've come to the end of the road, the end of the road) Still, I can't let go (Oh my God, oh my God, help me out a little bit, baby) It's unnatural (Baby), you belong to me (Baby), I belong to you (Baby) Although we've come to the end of the road Still, I can't let go (Alright, alright, alright) It's unnatural, you belong to me, I belong to you (It's unnatural, you belong to me, I belong to you, woah) Come to the end of the road (Although we've come to the end of the road) Still, I can't let go (I know I just can't let go, no) It's unnatural, you belong to me, I belong to you (No, no, no, no, no, no, no, no)34Embed"
The Weather Girls,It's Raining Men,pop,"57 ContributorsTranslationsMagyarIt’s Raining Men Lyrics[Intro] Hi! (Hi!) We're your weather girls (Uh-huh) And have we got news for you! (You better listen) Get ready all you lonely girls And leave those umbrellas at home (Alright)  [Pre-Chorus] Humidity is rising (Mm rising), barometer's getting low (How low, girl?) According to all sources  (What sources now?) The street's the place to go (You better hurry up) 'Cause tonight for the first time (First time) Just about half-past ten (Half-past ten) For the first time in history It's gonna start raining men (Start raining men)  [Chorus] It's raining men! Hallelujah! It's raining men! Amen! I'm gonna go out to run and let myself get Absolutely soaking wet! It's raining men! Hallelujah! It's raining men! Every specimen! Tall, blonde, dark and lean Rough and tough and strong and mean You might also like[Verse 1] God bless Mother Nature, she's a single woman too She took off to heaven and she did what she had to do She bought every angel And rearranged the sky So that each and every woman could find her perfect guy  [Chorus] It's raining men! Hallelujah! It's raining men! Amen! It's raining men! Hallelujah! It's raining men! Amen!  [Bridge] I feel stormy weather moving in About to begin (About to begin) Hear the thunder, don't you lose your head Rip off the roof and stay in bed (Rip off the roof and stay in bed)  [Verse 2] God bless Mother Nature, she's a single woman too She took off to heaven and she did what she had to do She bought every angel She rearranged the sky So that each and every woman could find her perfect guy Oh, it's raining men! Yeah [Pre-Chorus] [?] Humidity is rising (Humidity is rising, yeah) (Oh, oh yes, rising) Barometer's getting low (Is getting low, low, low, low, low, low, low, low, is getting low) According to all sources (According to all sources) The street's the place to go 'Cause tonight for the first time Just about half-past ten (half-past ten) For the first time in history It's gonna start raining men (It's gonna start raining men)  [Chorus] It's raining men! (Woo!) Hallelujah! It's raining men! Amen! It's raining men! Hallelujah! It's raining men! Amen! It's raining men! Hallelujah! It's raining men! Amen! It's raining men! Hallelujah! It's raining men! Amen! (Tall, blonde, dark and lean) (Rough and tough and strong and mean) She taught every angel She rearranged the sky (It's Raining Men! Hallelujah!) (It's Raining Men! Hallelujah!)10Embed"
