artist_name,track_name,genre,lyrics,,,,,,,,,,,,,,,,,,,,,,,,,,,,,,,,,,,,,,,,,,,,,,,,,,,,,,,,,,,,,,,,,,,,,,,,,,,,,,,,,,,,,,,,,,,,,,,,,,,,,,,,,,,,,,,,,,,,,,,,,,,,,,,,,,,,,,,,,,,,,,,,,,,,,,,,,,,,,,,,,,,,,,,,,,,,,,,,,,,,,,,,,,,,,,,,,,,,,,,,,,,,,,,,,,
Cardi B,WAP (feat. Megan Thee Stallion),hip_hop,"11 ContributorsFFM Freestyl–µ: ALIZADE LyricsCardi B ‚Äî ¬´WAP¬ª (feat. Megan Thee Stallion)  –≠–π, —ç–π, —ç–π, —ç–π, bitch, bitch, —ç–π, —ç–π –ú–Ω–µ –Ω–µ –Ω—É–∂–µ–Ω —Å—Ç—Ä–µ—Å—Å, –Ω–µ –Ω—É–∂–Ω–∞ –º–Ω–µ –¥—Ä–∞–º–∞, –º –£ –º–µ–Ω—è –µ—Å—Ç—å –≤–µ—Å, —è –±–æ–ª—å—à–∞—è –º–∞–º–∞, –º –Ø –≥—Ä—è–∑–Ω–∞—è —Å—É–∫–∞, –Ω–æ, —É –º–µ–Ω—è —á–∏—Å—Ç–∞ –∫–∞—Ä–º–∞, –º, –º –ú–∞–º–∞ billionaire, Dolce & Gabanna, –∞ Dolce & Gabanna, Dolce & Gabanna, –º –ú–Ω–µ –Ω—É–∂–µ–Ω —Ç–æ–ª—å–∫–æ —Å–µ–∫—Å –∏ –±–æ–≥–∞—Ç—ã–π –ø–∞–ø–∞, –º, –º Dolce & Gabanna, Dolce & Gabanna, –º –ú–Ω–µ –Ω—É–∂–µ–Ω —Ç–æ–ª—å–∫–æ —Å–µ–∫—Å –ì–ª–∞–∑–∞–º–∏ —Ö–ª–æ–ø–∞–π hoe, —Ö–ª–æ–ø–∞–π hoe –ö–∞–±–ª–æ–º Louis —Ç–æ–ø–∞–π hoe, bitch, —Ç–æ–ø–∞–π hoe –î–µ–ª–∞–π –≤–∏–¥, —á—Ç–æ —Ç—ã —Ç—É–ø–∞—è hoe, —Ç—É–ø–∞—è hoe –ï—Å–ª–∏ —Ö–æ—á–µ—à—å –±—ã—Ç—å –±–æ–≥–∞—Ç–æ–π hoe, –±–æ–≥–∞—Ç–æ–π hoe –≠–π, –º–Ω–µ –Ω–µ –Ω—É–∂–µ–Ω —Å—Ç—Ä–µ—Å—Å, –Ω–µ –Ω—É–∂–Ω–∞ –º–Ω–µ –¥—Ä–∞–º–∞, –º –£ –º–µ–Ω—è –µ—Å—Ç—å –≤–µ—Å, —è –±–æ–ª—å—à–∞—è –º–∞–º–∞ –Ø –≥—Ä—è–∑–Ω–∞—è —Å—É–∫–∞, –Ω–æ, —É –º–µ–Ω—è —á–∏—Å—Ç–∞ –∫–∞—Ä–º–∞, –º –ú–∞–º–∞ billionaire, Dolce & Gabanna, bitch, –∞ Dolce & Gabanna, Dolce & Gabanna, –∞ –ú–Ω–µ –Ω—É–∂–µ–Ω —Ç–æ–ª—å–∫–æ —Å–µ–∫—Å –∏ –±–æ–≥–∞—Ç—ã–π –ø–∞–ø–∞, –º Dolce & Gabanna, Dolce & Gabanna –ú–Ω–µ –Ω—É–∂–µ–Ω —Ç–æ–ª—å–∫–æ —Å–µ–∫—Å, –∞—Ö, bitch –≠-—ç, —Ö–∞-—Ö–∞-—Ö–∞  Missy Elliott ‚Äî ¬´Get Ur Freak On¬ª You might also like–•–∞-—Ö–∞, bitch, —ç–π, –∞-–∞-–∞-–∞, –∞-—è-—è-—è-—è, —ç–π –û–¥–Ω–∞–∂–¥—ã –¥–Ω—ë–º, —Ç–∞ —Å—É–∫–∞ –≤–æ—Ä–≤–∞–ª–∞—Å—å –≤ –º–æ–π –¥–æ–º –≤ —Å–ª–µ–∑–∞—Ö –ù–∞ –Ω–µ–ø–æ–Ω—è—Ç–Ω–æ–º —è–∑—ã–∫–µ –±–∞–∑–∞—Ä–∏–ª–∞ –ø—Ä–æ —Ç–µ–±—è –û–Ω–∞ —Å–∫–∞–∑–∞–ª–∞, —á—Ç–æ —Ç—ã ‚Äî –ø–∏–¥–æ—Ä –û–Ω–∞ —Å–∫–∞–∑–∞–ª–∞, —á—Ç–æ —Ç—ã ‚Äî –ø–∏–¥–æ—Ä, —ç –ú–µ–Ω—è –Ω–µ –ª—é–±—è—Ç –∑–∞ —Ç–æ, —á—Ç–æ —è –¥–µ–ª–∞—é –æ—á–µ–Ω—å –º–Ω–æ–≥–æ money –í–µ–¥—å —è –Ω–æ—á–∞–º–∏ –∏ –¥–Ω—è–º–∏ —Ä–∞–±–æ—Ç–∞—é ‚Äî –ê—Å—è –Ω–µ –±—ã–≤–∞–µ—Ç free –°—É–º–æ—á–∫–∏ Gucci –∏ –±—Ä—é–∫–∏ –º–µ–Ω—è—é, –∫–∞–∫ –º–µ–Ω—è—é [?] –ï—Å–ª–∏ –±—ã –æ–Ω –±—ã–ª –¥–µ–≤—É—à–∫–æ–π, —Ç–æ –±—ã–ª –±—ã —Å–∞–º—ã–π ugly bitch, —ç–π Ugly-ugly-ugly bitch, —ç–π Ugly-ugly-ugly bitch, —É-—ç Ugly-ugly-ugly bitch Bad bitches –∑–Ω–∞—é—Ç –∫–∞–∫ –∏ –≥–¥–µ, —á–µ–º –º–æ–∂–Ω–æ –∑–∞—Ä–∞–±–æ—Ç–∞—Ç—å –£ –Ω–∏—Ö –µ—Å—Ç—å –±–ª–∞–Ω—Ç—ã, bitches baking soda, Minniesota Bad bitches –∑–Ω–∞—é—Ç –∫–∞–∫ –∏ –≥–¥–µ, —á–µ–º –º–æ–∂–Ω–æ –∑–∞—Ä–∞–±–æ—Ç–∞—Ç—å –£ –Ω–∏—Ö –µ—Å—Ç—å –±–ª–∞–Ω—Ç—ã, bitches baking soda, Minniesota Minnie-Minniesota, Minnie-Minniesota, bitch Lick my pussy, please, —ç—Ö  Flo Milli ‚Äî ¬´In The Party¬ª  –≠-—ç-—ç-—ç–π, —è-–∞–π, —è-–∞–π, —è-–∞–π, —ç–π, —ç–π, —ç–π –≠–π, —ç–π, —ç–π, —Å—É–∫–∞ –û–Ω–∞ —Å–≤—è—Ç–∞—è hoe, –æ–Ω–∞ —Å–≤—è—Ç–∞—è –≤–µ–¥—å–º–∞, –º, –º –£ –Ω–µ—ë —á—ë—Ä–Ω—ã–π –∫–æ—Ç, –ø–æ–≤–æ–¥–æ–∫ –æ—Ç Vetements, –º, –º –û–Ω–∞ –º–∞–ª–µ–Ω—å–∫–∞—è, –æ–Ω–∞ –∫–∞–∫ —Ä—ã–±–∫–∞ –ù–µ–º–æ [?] –≤–æ–π–Ω–∞ –°–∞–±—Ä–∏–Ω–∞, —Ç–∞–º –°–∞–±—Ä–∏–Ω–∞ –ú–∞–ª–µ–Ω—å–∫–∞—è –≤–µ–¥—å–º–∞, –∞–π, –∞–π –°–∞–±—Ä–∏–Ω–∞ –º–∞–ª–µ–Ω—å–∫–∞—è –≤–µ–¥—å–º–∞, —ç–π, —ç–π –ú–∞–ª—ã—à–∫–∞ –∏–≥—Ä–∞–µ—Ç –Ω–∞ –Ω–µ—Ä–≤–∞—Ö, –æ–Ω–∞ ‚Äî –º—É–∑—ã–∫–∞–Ω—Ç –ï—ë –º–µ—Ç–ª–∞ —ç—Ç–æ lambo, don't be slatt –ê–π, –æ–Ω–∏ –≤—Å–µ –º–Ω–µ –≥–æ–≤–æ—Ä—è—Ç, Alizade, ‚Äî –∏–¥–∏ —Ç—ã –≤ –∫–æ–ª–ª–µ–¥–∂, —ç–π –°–º–æ—Ç—Ä—é –Ω–∞ –Ω–∏—Ö –∫–∞–Ω–∞–ø—É, –∏ –æ—Ç–ø—Ä–∞–≤–ª—è—é –µ—ë message, —ç –ü–æ–¥–Ω–∏–º–∏ –≥–æ–ª–æ–≤—É, —É, –∏ –ø–æ—Å–º–æ—Ç—Ä–∏ –Ω–∞ –º–æ–π outfit, —É Look at my outfit, –∞, look at my outfit –ú–µ–Ω—è –Ω–µ –ª—é–±—è—Ç –∑–∞ —Ç–æ, —á—Ç–æ —è –¥–µ–ª–∞—é –æ—á–µ–Ω—å –º–Ω–æ–≥–æ money, –∏ –í–µ–¥—å —è –Ω–æ—á–∞–º–∏ –∏ –¥–Ω—è–º–∏ —Ä–∞–±–æ—Ç–∞—é ‚Äî –ê—Å—è –Ω–µ –±—ã–≤–∞–µ—Ç free –°—É–º–æ—á–∫–∏ Gucci –∏ –±—Ä—é–∫–∏ –∫–∞–∫ [?] –ï—Å–ª–∏ –±—ã –æ–Ω –±—ã–ª –¥–µ–≤—É—à–∫–æ–π, —Ç–æ –±—ã–ª –±—ã —Å–∞–º—ã–π ugly bitch, —ç–π –î–∞–π –º–Ω–µ, –¥–∞–π –º–Ω–µ, –¥–∞–π –º–Ω–µ, –¥–∞–π –º–Ω–µ —ç—Ç–∏ –¥–µ–Ω—å–≥–∏ –Ø –ø–æ–ª—É—á–∞—é —ç—Ç–∏-—ç—Ç–∏-—ç—Ç–∏ –¥–µ–Ω—å–≥–∏ –Ø —Ö–æ—á—É —Å–æ—Å–∞—Ç—å —Ç–≤–æ–∏ –¥–µ–Ω—å–≥–∏ –î–∞–π –º–Ω–µ, –¥–∞–π –º–Ω–µ, –¥–∞–π –º–Ω–µ, –¥–∞–π –º–Ω–µ –≤—Å–µ –¥–µ–Ω—å–≥–∏ –≠, —ç, –≤—Å–µ –¥–µ–Ω—å–≥–∏, —ç, —ç –≤—Å–µ –¥–µ–Ω—å–≥–∏, —ç, —ç –≤—Å–µ –¥–µ–Ω—å–≥–∏ –î–∞–π –º–Ω–µ, —Å—É–∫–∞, —ç—Ç–∏ –¥–µ–Ω—å–≥–∏, bitch, —ç–π Baauer ‚Äî ¬´Dum Dum¬ª (Kristina Si ‚Äî ¬´–ù—É –ù—É –î–∞¬ª)  –•–∞-—Ö–∞, —ç–π Don't be selavi, –º–∞–º–∞ –∏–¥–µ–∞–ª –¢—ã —Ö–æ—á–µ—à—å –ø–æ–π—Ç–∏ —Å –Ω–µ–π –Ω–∞ –±–∞–ª, –Ω–æ –æ–Ω–∞ –Ω–µ typical, —ç–π –°—É–∫–∞ –Ω–µ typical, —ç–π, —ç–π Don't be selavi, –º–∞–º–∞-–º–∞–º–∞ –∏–¥–µ–∞–ª –¢—ã —Ö–æ—á–µ—à—å –ø–æ–π—Ç–∏ —Å –Ω–µ–π –Ω–∞ –±–∞–ª, –Ω–æ –æ–Ω–∞ –Ω–µ typical –ù–æ –æ–Ω–∞ –Ω–µ typical, –Ω–æ –æ–Ω–∞ –Ω–µ typical, –Ω–æ –æ–Ω–∞ –Ω–µ typical, bitch Bratz, bratz, –±–æ–ª—å—à–∏–µ –¥–µ–Ω—å–≥–∏, bratz, bratz –ò–¥–µ–∞–ª baby, bratz, bratz, sub star, baby, bratz, bratz –≠–π, —ç–π, —ç–π Why you mad? –°—É–∫–∞, why you mad? –ê –ü–æ—Å—Ç—É–ø–∏–ª–∞ mad, –æ—Ç–ª–∏—á–∏ –º–æ–π –∫–æ—Å—è–∫, –∞ –¢—ã –Ω–µ cat, –Ω–µ –º—è—É–∫–∞–π, –±–ª—è, –∞ –ñ–æ–ø–∞ —Ñ–µ, no cap, –∞ –¢–≤–æ—è –¥–æ—Å–∫–∏, –Ω–µ [?] –û–Ω–∞ —Ö–æ—á–µ—Ç –¥—Ä–∞—Ç—å—Å—è, —è –º–µ–Ω—è—é –¥–æ—Å–ø–µ—Ö –Ø –Ω–µ –¥–µ—Ä—É—Å—å, —è –ø–æ–∫–∞–∑—ã–≤–∞—é —É—Å–ø–µ—Ö –†–∞–∑—ä–µ–±–∞–ª–∞ –Ω–∞ —Ä–∞—Å—Ö–≤–∞—Ç, —Ç–≤–æ—è hoe —Å–ø–∏—Ç –≠–π, —ç–π, bratz, bratz, bratz, bratz, –±–æ–ª—å—à–∏–µ –¥–µ–Ω—å–≥–∏ Bratz, bratz, bratz, bratz, –±–æ–ª—å—à–∏–µ –¥–µ–Ω—å–≥–∏, bitch So more dick –©–∞ –Ω–æ–≤—ã–π —Ç—Ä–µ–∫ –û–±–ª–∏–∂–∏ –º–Ω–µ –º–æ—é –ø–∏—Å—å–∫—É –û–±–ª–∏–∂–∏ –º–æ—é –ø–∏—Å—å–∫—É Lick my pussy, lick my pussy, lick my pussy, —ç–π Lick my pussy, lick my pussy, lick my pussy, —ç–π, —ç–π, —ç–π, —ç–π –î–æ—Ä–æ–≥–∞—è, —Ç–µ–±–µ –Ω–µ –ª–∏–∂—É—Ç –ø–∏–∑–¥—É, —ç—Ç–æ –≤–∏–¥–Ω–æ –•–∞-—Ö–∞-—Ö–∞-—Ö–∞Embed",,,,,,,,,,,,,,,,,,,,,,,,,,,,,,,,,,,,,,,,,,,,,,,,,,,,,,,,,,,,,,,,,,,,,,,,,,,,,,,,,,,,,,,,,,,,,,,,,,,,,,,,,,,,,,,,,,,,,,,,,,,,,,,,,,,,,,,,,,,,,,,,,,,,,,,,,,,,,,,,,,,,,,,,,,,,,,,,,,,,,,,,,,,,,,,,,,,,,,,,,,,,,,,,,,
Fetty Wap,Trap Queen,hip_hop,"253 ContributorsTrap Queen Lyrics[Intro] RGF productions Remy Boyz, yah-ah 1738, ayy  [Refrain] I'm like ""Hey, what's up? Hello"" (Ayy) Seen yo pretty ass soon as you came in the door I just wanna chill, got a sack for us to roll Married to the money, introduced her to my stove Showed her how to whip it, now she remixin' for low She my trap queen, let her hit the bando We be countin' up, watch how far them bands go We just set a goal, talkin' matchin' Lambos At 56 a gram, 5 a hundred grams though Man, I swear I love her, how she work the damn pole Hit the strip club, we be lettin' bands go Everybody hatin', we just call them fans, though In love with the money, I ain't never lettin' go  [Chorus] And I get high with my baby (My baby) I just left the mall, I'm gettin' fly with my baby, yeah And I can ride with my baby (My baby) I be in the kitchen cookin' pies with my baby, yeah And I can ride with my baby (My baby) I just left the mall, I'm gettin' fly with my baby, yeah And I can ride with my baby I be in the kitchen cookin' pies You might also like[Verse 1] I'm like, ""Hey, what's up? Hello"" I hit the strip with my trap queen, 'cause all we know is bands I just might snatch up a 'Rari and buy my boo a Lamb' I just might snatch her a necklace, drop a couple on a ring She ain't wantin' for nothin' because I got her everything It's big ZooWap from the bando Remind me where I can't go Remy Boyz got the stamp though Count up hella them bands though Boy how far can your bands go? Fetty Wap, I'm livin' fifty thousand K how I stand though If you checkin' for my pockets I'm like‚Ä¶  [Chorus] And I get high with my baby (My baby) I just left the mall, I'm gettin' fly with my baby, yeah And I can ride with my baby (My baby) I be in the kitchen cookin' pies with my baby, yeah And I can ride with my baby (My baby) I just left the mall, I'm gettin' fly with my baby, yeah And I can ride with my baby (My baby) I be in the kitchen cookin' pies  [Refrain] I'm like, ""Hey, what's up? Hello"" Seen yo' pretty ass soon as you came in the door I just wanna chill, got a sack for us to roll Married to the money, introduced her to my stove Showed her how to whip it, now she remixin' for low She my trap queen, let her hit the bando We be countin' up, watch how far them bands go We just set a goal, talkin' matchin' Lambos At 56 a gram, 5 a hundred grams though Man, I swear I love her how she work the damn pole Hit the strip club, we be lettin' bands go Everybody hatin', we just call them fans though In love with the money, I ain't never lettin' go [Verse 2] I be smokin' dope and you know Backwoods what I roll Remy Boyz, Fetty eatin' shit up, that's fasho I'll run in ya house, then I'll fuck your ho 'Cause Remy Boyz or nothin' Re-Re-Remy Boyz or nothin', yeah  [Outro: Nitt Da Gritt] Yeah, you hear my boy Soundin' like a zillion bucks on the track I got whatever on my boy, whatever Put your money where your mouth is Money on the wood make the game go good Money out of sight cause fights Put up or shut up, huh? Nitt Da Gritt, huh, RGF Productions Squad3.2KEmbed",,,,,,,,,,,,,,,,,,,,,,,,,,,,,,,,,,,,,,,,,,,,,,,,,,,,,,,,,,,,,,,,,,,,,,,,,,,,,,,,,,,,,,,,,,,,,,,,,,,,,,,,,,,,,,,,,,,,,,,,,,,,,,,,,,,,,,,,,,,,,,,,,,,,,,,,,,,,,,,,,,,,,,,,,,,,,,,,,,,,,,,,,,,,,,,,,,,,,,,,,,,,,,,,,,
Meek Mill,Going Bad (feat. Drake),hip_hop,2 ContributorsMeek Mill Essentials Lyrics1. Meek Mill- Believe (feat. Justin Timberlake) 2. Meek Mill- Going Bad (feat. Drake) 3. Meek Mill- Dreams and Nightmares 4. Meek Mill- Levels 5. Meek Mill- 24/7 (feat. Elle Mai) 6. Meek Mill- 1942 Flows 7. Meek Mill- All Eyes On You (feat. Chris Brown & Nicki Minaj) 8. Meek Mill- Letter To Nipsey (feat. Roddy Ricch) 9. Meek Mill- Millidelphia (feat. Swizz Beats) 10. Meek Mill- On Me (feat. Cardi B) 11. Meek Mill- Litty (feat. Tory Lanez) 12. Meek Mill- Uptown Vibes (feat. Fabolous & Anuel AA) 13. Meek Mill- R.I.C.O. (feat. Drake) 14. Meek Mill- Stay Woke (feat. Miguel) 15. Meek Mill- What's Free (feat. Rick Ross & JAY-Z) 16. Meek Mill- Whatever You Need (feat. Chris Brown & Ty Dolla $ign) 17. Meek Mill- Dangerous (feat. Jeremih & PnB Rock) 18. Meek Mill- Ima Boss (feat. Rick Ross) 19. Meek Mill- Amen (feat. Drake) 20. Meek Mill- Oodles O' Noodles Babies 21. Meek Mill- 1am 22. Meek Mill- Jump Out the Face (feat. Future) 23. Meek Mill- House Party (feat. Young Chris) 24. Meek Mill- Burn (feat. Big Sean) [Bonus Track] 25. Meek Mill- Tupac Back (feat. Rick Ross) 26. Meek Mill- Monster 27. Meek Mill- Lord Knows (feat. Tory Lanez)You might also likeEmbed,,,,,,,,,,,,,,,,,,,,,,,,,,,,,,,,,,,,,,,,,,,,,,,,,,,,,,,,,,,,,,,,,,,,,,,,,,,,,,,,,,,,,,,,,,,,,,,,,,,,,,,,,,,,,,,,,,,,,,,,,,,,,,,,,,,,,,,,,,,,,,,,,,,,,,,,,,,,,,,,,,,,,,,,,,,,,,,,,,,,,,,,,,,,,,,,,,,,,,,,,,,,,,,,,,
21 Savage,a lot,hip_hop,"446 ContributorsTranslationsT√ºrk√ßeEspa√±ol–†—É—Å—Å–∫–∏–πPortugu√™sa lot Lyrics[Intro: 21 Savage] I love you Turn my headphone down a little bit, yeah For so many reasons Yeah, yeah, yeah, yeah, yeah, yeah (I do), yeah, yeah yeah yeah Yeah, yeah, ah, ah, woah, woah, woah, yeah  [Pre-Chorus: 21 Savage] How much money you got? (Straight up) How much money you got? (Straight up) How much money you got? (Straight up) How much money you got? (A lot)  [Chorus: 21 Savage] How much money you got? (A lot) How many problems you got? (A lot) How many people done doubted you? (A lot) Left you out to rot? (A lot) How many pray that you flop? (A lot) How many lawyers you got? (A lot) How many times you got shot? (A lot) How many niggas you shot? (A lot) How many times did you ride? (A lot) How many niggas done died? (A lot) How many times did you cheat? (A lot) How many times did you lie? (A lot) How many times did she leave? (A lot) How many times did she cry? (A lot) How many chances she done gave you fuckin around with these thots? (A lot) See 21 Savage LiveGet tickets as low as $75You might also like[Verse 1: 21 Savage] Every day that I'm alive, I‚Äôma ride with the stick I'd rather be broke in jail than be dead and rich Told my brothers take my breath if I turn to a snitch But I'm 21 4L, ain‚Äôt no way I'ma switch  [Interlude] Break it down, I break it down I break it down, I break it down I break it down, I break it down I break it down, I break it down  [Verse 2: 21 Savage] Penitentiary chances just to make a couple bucks My heart so cold I could put it in my cup Gang vs. the world, me and my dawg, it was us Then you went and wrote a statement, and that really fucked me up My brother lost his life and it turned me to a beast My brother got life and it turned me to the streets I been through the storm and it turned me to a G But the other side was sunny, I get paid to rap on beats  [Chorus: 21 Savage] How much money you got? (A lot) How many problems you got? (A lot) How many people done doubted you? (A lot) Left you out to rot? (A lot) How many pray that you flop? (A lot) How many lawyers you got? (A lot) How many times you got shot? (A lot) How many niggas you shot? (A lot) How many times did you ride? (A lot) How many niggas done died? (A lot) How many times did you cheat? (A lot) How many times did you lie? (A lot) How many times did she leave? (A lot) How many times did she cry? (A lot) How many chances she done gave you? Fuck around with these thots (A lot) [Interlude: J. Cole] Break it on down, I break it on down I break it on down, I break it on down Yeah, I just came from the A I drove back home, six-hour drive, six-and-a-half Before I left, I stopped by to see my nigga 21 in the studio He had two of his kids with him right in the studio, that's when I knew You a stand-up nigga, I love seein' shit like that [Verse 3: J. Cole] Question How many faking they streams? (A lot) Getting they plays from machines? (A lot) I can see behind the smoke and mirrors Niggas ain't really big as they seem (Hmm) I never say anything (Nah), everybody got they thing (True) Some niggas make millions, other niggas make memes (Hmm) I'm on a money routine I don't want smoke, I want cream I don't want no more comparisons This is a marathon and I‚Äôm aware I been playing it back from a lack of promotions I never was one for the bragging and boasting I guess I was hoping the music would speak for itself, but the people want everything else Okay, no problem, I‚Äôll show up on everyone album You know what the outcome will be I'm batting a thousand It‚Äôs got to the point that these rappers don't even like rappin' with me Fuck it 'cause my nigga 21 Savage just hit me And told me he saved me a spot on a new record he got He call it ""a lot,"" I open my book and I jot Pray for Tekashi, they want him to rot I picture him inside a cell on a cot ‚ÄôFlectin' on how he made it to the top Wondering if it was worth it or not I pray for Markelle 'cause they fucked up his shot Just want you to know that you got it, my nigga Though I never met you, I know that you special And that the Lord blessed you, don't doubt it, my nigga Dennis Smith, Jr., stay solid, my nigga I'm on a tangent, not how I planned it I had some fans that hopped and abandoned ship When they thought that I wasn't gon' pan out, I got a plan They say that success is the greatest revenge, tell all your friends Cole on a mission, cementin' the spot as the greatest that did it Before it all ends, nigga [Chorus: 21 Savage] How much money you got? (A lot) How many problems you got? (A lot) How many people done doubted you? (A lot) Left you out to rot? (A lot) How many pray that you flop? (A lot) How many lawyers you got? (A lot) How many times you got shot? (A lot) How many niggas you shot? (A lot) How many times did you ride? (A lot) How many niggas done died? (A lot) How many times did you cheat? (A lot) How many times did you lie? (A lot) How many times did she leave? (A lot) How many times did she cry? (A lot) How many chances she done gave you? Fuck around with these thots (A lot)  [Outro] Break it on down, I break it on down I break it on down, I break it on down I break it down, I break it down I break it down, I break it down I break it on down, I break it down I break it down, I break it down I break it down, I break it down I break it down, I break it down, I br-279Embed",,,,,,,,,,,,,,,,,,,,,,,,,,,,,,,,,,,,,,,,,,,,,,,,,,,,,,,,,,,,,,,,,,,,,,,,,,,,,,,,,,,,,,,,,,,,,,,,,,,,,,,,,,,,,,,,,,,,,,,,,,,,,,,,,,,,,,,,,,,,,,,,,,,,,,,,,,,,,,,,,,,,,,,,,,,,,,,,,,,,,,,,,,,,,,,,,,,,,,,,,,,,,,,,,,
Polo G,RAPSTAR,hip_hop,"171 ContributorsTranslationsT√ºrk√ßeEspa√±ol–†—É—Å—Å–∫–∏–πÊó•Êú¨Ë™ûItalianoDeutschPolskiRAPSTAR Lyrics[Intro] (Shout out my nigga Synco)  [Chorus] Uh (Tuned up), copped a BMW, new deposit, I picked up‚ÄÖanother‚ÄÖbag Like fuck it,‚ÄÖI'ma count while I'm in it I‚ÄÖhear planes flyin', crowds screamin', money counters, chains clangin' Shit, I‚Åüguess‚Åüthat's‚Åühow it sound‚Åüwhen you winnin' I‚Åüain't jokin', do it sound like I'm kiddin'? I been makin' like two thousand a minute So high up through the clouds, I was swimmin' I'm probably gon' drown when I'm in it I bet she gon' get loud when I'm in it And we might have a child when I'm finished  [Verse 1] Uh, I won't love a ho, after we fuck, she can't get near me Only bitch I give a conversation to is Siri My pants Amiri, yes, I'm winnin', clearly I'm the chosen one, seen my potential, so they fear me Lately I've been prayin', God, I wonder, can You hear me? Thinkin' 'bout the old me, I swear I miss you dearly Stay down 'til you come up, I've been stickin' to that theory Every day a battle, I'm exhausted and I'm weary Make sure I smile in public, when alone, my eyes teary I fought through it all, but that shit hurt me severely I've been gettin' high to hide behind my insecurities Takin' different pills, but I know it ain't gon'‚Äî See Polo G LiveGet tickets as low as $37You might also like[Chorus] Uh, copped a BMW, new deposit, I picked up another bag Like fuck it, I'ma count while I'm in it I hear planes flyin', crowds screamin', money counters, chains clangin' Shit, I guess that's how it sound when you winnin' I ain't jokin', do it sound like I'm kiddin'? I been makin' like two thousand a minute So high up through the clouds, I was swimmin' I'm probably gon' drown when I'm in it I bet she gon' get loud when I'm in it (Uh, uh) And we might have a child when I'm finished  [Verse 2] They say I'm Pac rebirth, never put out a weak verse Homicides when we lurk, I'ma step 'til my feet hurt Been puttin' them streets first White tees turned burgundy t-shirts Lookin' for somethin' real, he stuck in a deep search Anxiety killin' me, I just want to leave Earth When they ask if I'm okay, it just make everything seem worse Try and explain your feelings, sound like something you rehearsed Stabbed me in my back with a clean smirk Lookin' so deep into your eyes, I can read your thoughts, so Shut the fuck‚Äî, I mean, please don't talk I done been through too much and I don't need another loss Put that on every war scar for every battle I fought [Chorus] Uh, copped a BMW, new deposit, I picked up another bag Like fuck it, I'ma count while I'm in it I hear planes flyin', crowds screamin', money counters, chains clangin' Shit, I guess that's how it sound when you winnin' I ain't jokin', do it sound like I'm kiddin'? I been makin' like two thousand a minute So high up through the clouds, I was swimmin' I'm probably gon' drown when I'm in it I bet she gon' get loud when I'm in it And we might have a child when I'm finished  [Outro] When I'm finished, when I'm finished190Embed",,,,,,,,,,,,,,,,,,,,,,,,,,,,,,,,,,,,,,,,,,,,,,,,,,,,,,,,,,,,,,,,,,,,,,,,,,,,,,,,,,,,,,,,,,,,,,,,,,,,,,,,,,,,,,,,,,,,,,,,,,,,,,,,,,,,,,,,,,,,,,,,,,,,,,,,,,,,,,,,,,,,,,,,,,,,,,,,,,,,,,,,,,,,,,,,,,,,,,,,,,,,,,,,,,
