artist_name,track_name,genre,lyrics,,,,,,,,,,,,,,,,,,,,,,,,,,,,,,,,,,,,,,,,,,,,,,,,,,,,,,,,,,,,,,,,,,,,,,,,,,,,,,,,,,,,,,,,,,,,,,,,,,,,,,,,,,,,,,,,,,,,,,,,,,,,,,,,,,,,,,,,,,,,,,,,,,,,,,,,,,,,,,,,,,,,,,,,,,,,,,,,,,,,,,,,,,,,,,,,,,,,,,,,,,,,,,,,,,
Future,Fuck Up Some Commas,hip_hop,"132 ContributorsTranslationsT√ºrk√ßePortugu√™sFuck Up Some Commas Lyrics[Intro] Fake nigga lie to a real nigga Now that's some shit that you don't do I'ma stay real for my real niggas Now that's some shit that I'm gon' do Fuck up the commas, let's fuck up some commas, nigga Let's fuck up some commas, let's do that shit random Yeah, Future, Future Hendrix, it's some shit you don't do Cut it up  [Chorus] Fuck up some commas Let's fuck up some commas, yeah Let's fuck up some commas Let's fuck up some commas, yeah Forty thou' to a hundred thou' Hundred thou', another hundred thou' Three hundred thou' to five hundred thousand A million, let's have a money shower Fuck up some commas Let's fuck up some commas, yeah Let's fuck up some commas Let's fuck up some commas, yeah Forty thou' to a hundred thou' A hundred thou', another hundred thou' Three hundred thou' to five hundred thousand A million, let's have a money shower You might also like[Verse 1] Fuck up the llama, I'm hot like a sauna, yeah The burner is on me, can't play with that money, yeah I'm fucking with shorty, I'm loving the way that she fucking me, yeah Give no fucks, yeah, we don't give no fucks, yeah Throw my cup, yeah, I just bought my plug, yeah Full of the mud, yeah, nigga get full of them drugs, yeah Feeling real right, yeah, I'm on same thing as Mike, yeah Bought a lil' ice, yeah, I wanna beat that dope like Ike, yeah  [Chorus] Fuck up some commas Let's fuck up some commas, yeah Let's fuck up some commas Let's fuck up some commas, yeah Forty thou' to a hundred thou' Hundred thou', another hundred thou' Three hundred thou' to five hundred thousand A million, let's have a money shower Fuck up some commas Let's fuck up some commas, yeah Let's fuck up some commas Let's fuck up some commas, yeah Forty thou' to a hundred thou' Hundred thou', another hundred thou' Three hundred thou' to five hundred thousand A million, let's have a money shower [Verse 2] Smoke the first forty-eight hours, grind 22 and sleep two hours Put 24s on the new Audi, white on white like baby powder Drop your bitch off at Fulton County, might count it up and then recount it Double cups like Tunechi, yeah, bust it down with these goonies, yeah Give no fucks, yeah, we don't give no fucks, yeah Go fill my cup, yeah, bitch, go fill my cup, yeah You heard that the slums made me, I'm cool with the Konvicts The coupe look like Akon, fuck all that bum shit  [Chorus] Fuck up some commas Let's fuck up some commas, yeah Let's fuck up some commas Let's fuck up some commas, yeah Forty thou' to a hundred thou' Hundred thou', another hundred thou' Three hundred thou' to five hundred thousand A million, let's have a money shower  [Verse 3] Fit it, critic, get it, hit it, run it, drill it, wet it, I'm in it, really Split it, fifty-fifty, ball, Reggie, ready, set, go Throw that money in the air, watch it fall to the floor Heard you ordered up C√Æroc, need to order up some more Audemars, yeah, eighty on the watch, yeah Katy Perry, yeah, servin' Katy Perry, yeah I should ball, yeah, I should break you off, yeah Break you off, yeah, made myself a boss, yeah [Chorus] Let's fuck up some commas Let's fuck up some commas, yeah Let's fuck up some commas Let's fuck up some commas, yeah Forty thou' to a hundred thou' Hundred thou', another hundred thou' Three hundred thou' to five hundred thousand A million, let's have a money shower  [Bridge] Give no fucks, yeah, we don't give no fucks, yeah Give no fucks, yeah, we don't give no fucks, yeah Forty thou' to a hundred thou' A hundred thou', another hundred thou' Three hundred thou' to five hundred thousand A million, let's have a money shower  [Outro] Let's have a money shower right now, oh Let's have a money shower right now, oh Let's have a money shower right now, let's go Let's have a money shower right now, let's go Let's have a money shower, oh, oh, oh, oh Forty thou' to a hundred thou' to a hundred thou' to a hundred thou' A million, Hendrix210Embed",,,,,,,,,,,,,,,,,,,,,,,,,,,,,,,,,,,,,,,,,,,,,,,,,,,,,,,,,,,,,,,,,,,,,,,,,,,,,,,,,,,,,,,,,,,,,,,,,,,,,,,,,,,,,,,,,,,,,,,,,,,,,,,,,,,,,,,,,,,,,,,,,,,,,,,,,,,,,,,,,,,,,,,,,,,,,,,,,,,,,,,,,,,,,,,,,,,,,,,,,,,,,,,,,,
Migos,T,hip_hop,"2 ContributorsZigZag Lyrics[Couplet Queen Tequila]  Au mic c‚Äôest Shalom La plus Queen Teq‚Äô de tes copines Mon flow il t‚Äôassomme Plus chaud qu‚Äôun porno teen Une rang√©e De Gaule comme Charles J‚Äôvous ensorcelle comme Charmed  T‚Äôes en zigzag comme la bouche de Marrone Tu croyais quoi, j‚Äôfais danser ta daronne On Binche Record pour le meilleur C'est dans mes cordes pour le pire j‚Äôai pas peur   S/o le T Migos peut s'rhabiller   [Refrain Queen Tequila]  Des hanches qu‚Äôondulent D–µs culs qui s‚Äôdressent Pour qu‚Äôon s‚Äôamuse Fil–µ ton adresse (x2) You might also like[Pont Slice] Trop de private joke dans le son (x2) J'ai z√©ro place dans l'level J'ai tout mis dans l'picon   [Couplet Queen Tequila]  Moi j'sais faire deux choses Gaut en t√©moigne j'suis diabolique Je sexe et je cause J‚Äôprends des d√©tours touristiques J‚Äôai des milliers d'Secrets d‚ÄôHistoire Et j'mets en Bern tout l‚ÄôPays de Loire   Ouais j‚Äôai la Binche Family dans le sang La vraie, la seule j‚Äôen oublie mes parents Etel, Mayenne, peu importe le temps Pour vous d'l‚Äô√©cole j'veux rester sur les bancs   [Refrain Queen Tequila] x2  L‚Äôalcool, la liche J‚Äôvous aime les gens L‚ÄôOr de mon Vif On Binche le sang ¬© Binche Family, 2021Embed",,,,,,,,,,,,,,,,,,,,,,,,,,,,,,,,,,,,,,,,,,,,,,,,,,,,,,,,,,,,,,,,,,,,,,,,,,,,,,,,,,,,,,,,,,,,,,,,,,,,,,,,,,,,,,,,,,,,,,,,,,,,,,,,,,,,,,,,,,,,,,,,,,,,,,,,,,,,,,,,,,,,,,,,,,,,,,,,,,,,,,,,,,,,,,,,,,,,,,,,,,,,,,,,,,
Polo G,Pop Out (feat. Lil Tjay),hip_hop,"89 ContributorsRanking Page: 50 Best Albums & 50 Best Songs of 2019 LyricsThis is the ranking page for the 2019 Year End Lists. The initial ordering for‚ÄÖalbums‚ÄÖand songs is‚ÄÖbased on the results of an‚ÄÖinitial round of voting‚Äîclick here to learn more.  Do not edit the lyrics of this page. Editing the lyrics will result in penalty boxing. If you would like something changed, annotate, discuss it in the suggestions, post in the thread, or message @BrianErwin.Top 50 Albums:1. Tyler the Creator, IGOR 2. Lana Del Rey, Norman Fucking Rockwell 3. Freddie Gibbs & Madlib, Bandana 4. FKA twigs, MAGDALENE 5. Young Thug, So Much Fun 6. Bille Eilish, WHEN WE FALL ASLEEP, WHERE DO WE GO? 7. Ariana Grande, thank u, next 8. Taylor Swift, Lover 9. DaBaby, Baby On Baby 10. YBN Cordae, The Lost Boy 11. Little Simz, Grey Area 12. Benny The Butcher, The Plugs I Met 13. Vampire Weekend, Father of the Bride 14. Post Malone, Hollywood's Bleeding 15. Rapsody, Eve 16. JPEGMAFIA, All My Heroes Are Cornballs 17. Clairo, Immunity 18. Solange, When I Get Home 19. Denzel Curry, ZUU 20. 21 Savage, i am > i was 21. Lizzo, Cuz I Love You 22. EARTHGANG, Mirrorland 23. Charli XCX, Charli 24. Danny Brown, uknowhatimsayin¬ø 25. Polo G, Die A Legend 26. BROCKHAMPTON, Ginger 27. Dave, PSYCHODRAMA 28. Anderson .Paak, Ventura 29. BTS, Map Of The Soul: Persona 30. Maggie Rogers, Heard It in a Past Life 31. Bon Iver, i, I 32. Teejayx6, Under Pressure 33. Jamila Woods, Legacy! Legacy! 34. clipping., There Existed An Addiction to Blood 35. Dreamville Records, Revenge of the Dreamers III 36. Skepta, Ignorance Is Bliss 37. James Blake, Assume Form 38. Weyes Blood, Titanic Rising 39. NF, The Search 40. Megan Thee Stallion, Fever 41. slowthai, Nothing Great About Britain 42. Bad Bunny, X 100pre 43. nobigdyl., LOWERCASE TAPE. 44. Rich Brian, The Sailor 45. Kano, Hoodies All Summer 46. Caroline Polachek, Pang 47. Zico, Thinking 48. Summer Walker, Over It 49. PNL, Deux fr√®res 50. 2 Chainz, Rap Or Go To The LeagueNotable albums that didn't make the list:Snoh Aalegra, Ugh, Those Feels Again Key!, So Emotional YNW Melly, Melly vs. Melvin Ari Lennox, Shea Butter Baby A Boogie Wit da Hoodie, Hoodie SZN IDK, Is He RealNotable albums released post-voting & pre-December 10:Album Graveyard:Chris Brown, Indigo Kanye West, Jesus Is King Willow Smith, WILLOW Doja Cat, Hot Pink Kevin Abstract, ARIZONA BABY Sabrina Carpenter, Singular: Act II Ed Sheeran, No. 6 Collaborations Project FINNEAS, Blood Harmony EP Jaden, ERYS Offset, Father of 4 Maxo Kream, Brandon Banks Carly Rae Jepsen, Dedicated blink-182, Nine Colde, Love Part 1 Future, Future Hndrxxx Presents: The WIZRD Yungblud, The Underrated Youth - EPTop 50 Songs:1. Lil Nas X, ‚ÄúOld Town Road (Remix)‚Äù feat. Billy Ray Cyrus 2. FKA Twigs, ‚ÄúCellophane‚Äù 3. Billie Eilish, ""bad guy"" 4. Denzel Curry, ""RICKY"" 5. DaBaby, ""Suge"" 6. Tyler, The Creator, ‚ÄúEARFQUAKE‚Äù 7. 21 Savage, ""a lot"" feat. J. Cole 8. Megan Thee Stallion, ""Hot Girl Summer"" feat Nicki Minaj & Ty Dolla $ign 9. Young Thug, ""Hot"" feat. Gunna 10. Solange, ""almeda"" feat. Playboi Carti & The Dream 11. Freddie Gibbs & Madlib, ""Crime Pays"" 12. Benny The Butcher, ""Crown For Kings"" feat. Black Thought 13. DaBaby, ""INTRO"" 14. J. Cole, ""Middle Child"" 15. Lana Del Rey, ""Norman fucking Rockwell"" 16. Taylor Swift, ‚ÄúLover‚Äù 17. Polo G, ""Pop Out"" feat. Lil Tjay 18. Lizzo, ‚ÄúJuice‚Äù 19. Lil Tecca, ""Ransom"" 20. Koffee, ""Rapture"" 21. Clairo, ‚ÄúBags‚Äù 22. Ariana Grande - ""break up with your girlfriend, i'm bored"" 23. Young Thug, ""The London"" feat. J. Cole and Travis Scott 24. YBN Cordae, ""Broke As Fuck"" 25. Dreamville, Earthgang and J. Cole, ""Sacrifices"" feat. Smino & Saba 26. SiR, ‚ÄúHair Down‚Äù feat. Kendrick Lamar 27. Danny Brown, ""Best Life"" 28. BTS, ""Boy With Luv"" feat. Halsey 29. Drake, ""Money In The Grave"" feat. Rick Ross 30. Pop Smoke, ""Welcome To The Party"" 31. Post Malone, ""Take What You Want"" feat. Travis Scott & Ozzy Osbourne 32. AKMU, ""How can I love the heartbreak, you're the one i love"" 33. BROCKHAMPTON, ""NO HALO"" 34. Kanye West, ""Use This Gospel"" 35. Stormzy, ""Wiley Flow"" 36. ROSAL√çA & J Balvin, ‚ÄúCon Altura‚Äù feat. El Guincho 37. Lil Uzi Vert, ""Sanguine Paradise"" 38. Lana Del Rey, ""Doin' Time"" 39. BLACKPINK, ""Kill This Love"" 40. Injury Reserve, ""Jailbreak the Tesla"" feat. Amin√© 41. A$AP Rocky, ""Babushka Boi"" 42. Teejayx6, ""Swipe Story"" 43. Juice WRLD & YoungBoy Never Broke Again, ""Bandit"" 44. NF, ""The Search"" 45. Lil Gotit, ""Da Real Hoodbabies"" 46. Vampire Weekend, ""Flower Moon"" 47. Skillet, ‚ÄúSave Me‚Äù 48. Lil Keed, ""Pull Up"" feat. Lil Uzi Vert & YNW Melly 49. Baekhyun, ""UN Village"" 50. Charli XCX, ""Gone"" feat. Christine and the QueensNotable songs that didn't make the list:Freddie Gibbs & Madlib - ""Palmolive"" feat. Pusha T & Killer Mike Pusha T, ""Coming Home"" feat. Lauryn Hill Lana Del Rey, ""hope is a dangerous thing for a woman like me to have - but i have it"" Ariana Grande - ""7 rings"" 645AR - ""Bible and a K"" Bad Bunny - ""Calla√≠ta"" Baby Keem - ""ORANGE SODA"" YNW Melly - ""223's"" feat. 9LOKKNINE FKA twigs, ‚Äúhome with you‚Äù FKA twigs, ‚Äúholy terrain‚Äù feat. Future Post Malone, ""Circles"" NF, ‚ÄúReturns‚Äù YBN Cordae, ""Have Mercy"" NF, ""Hate Myself"" Snoh Aalegra, ‚ÄúNothing To Me‚ÄùNotable songs released post-voting & pre-December 10:The Weeknd, ""Blinding Lights""Song Graveyard:Lizzo, ‚ÄúTruth Hurts‚Äù Nipsey Hussle, ""Racks In The Middle"" feat. Roddy Ricch & Hit-Boy Mustard feat. Roddy Ricch, ""Ballin'"" Afro B ""Drogba (Joanna)"" Danny Brown, ‚ÄúDirty Laundry‚Äù Post Malone, ""Die For Me"" feat. Future & Halsey YNW Melly - ""Murder On My Mind"" Ed Sheeran, ""Take Me Back To London"" feat. Stormzy PNL, ""Au DD"" Dua Lipa, ""Don't Start Now"" Chris Brown, ""No Guidance"" feat. Drake Steve Malcolm, ""Summertime"" feat. Jayway Ruel, ‚ÄúFree Time‚Äù Travis Scott, ""Highest In The Room"" Lewis Capaldi ""Someone You Loved""3Embed",,,,,,,,,,,,,,,,,,,,,,,,,,,,,,,,,,,,,,,,,,,,,,,,,,,,,,,,,,,,,,,,,,,,,,,,,,,,,,,,,,,,,,,,,,,,,,,,,,,,,,,,,,,,,,,,,,,,,,,,,,,,,,,,,,,,,,,,,,,,,,,,,,,,,,,,,,,,,,,,,,,,,,,,,,,,,,,,,,,,,,,,,,,,,,,,,,,,,,,,,,,,,,,,,,
A Boogie Wit da Hoodie,Drowning (feat. Kodak Black),hip_hop,"3 ContributorsNew Music Friday 03/10/17 LyricsStargate - Waterfall feat. P!nk & Sia Nicki Minaj, Drake & Lil Wayne - No Frauds Amin√© - REDMERCEDES Lorde - Liability Amir Obe - WISH YOU WELL Vice - Obsession feat. Jon Bellion Basic Tape - No Matter 2 Chainz - It's A Vibe feat. Ty Dolla $ign, Trey Songz & Jhene Aiko Charli XCX - 3AM (Pull Up) feat. M√ò Astrid S - Breathe Hey Violet - Break My Heart Elle King - Wild Love Pitbull & J Balvin - Hey Ma feat. Camila Cabello (Spanish Version) Rick Ross - Trap Trap Trap feat. Young Thug & Wale Yellow Claw - Stacks feat. Quavo, Tinie Tempah & Cesqeaux Trey Songz - She Lovin It K.Flay - High Enough The Shins - Painting a Hole Alt-J - 3WW Judah & the Lion - Green Eyes Laura Marling - Always This Way Yoke Lore - World Wings Colouring - Heathen Fickle Friends - Hello Hello MOD SUN - Spent All My Money... feat. Blackbear A Boogie Wit da Hoodie - Drowning feat. Kodak Black FLETCHER - Wasted Youth (Michael Brun Remix) Brian Fresco - Higher feat. Chance The Rapper & Blue Hawaii XYL√ò - I Still Wait For You A Great Big World - When I Was a Boy COIN - Malibu 1992 Computer Games & Darren Criss - Lost Boys Life Jon Bellion - All Time Low feat. Stormzy Matoma & MAGIC! - Girl At Coachella feat. D.R.A.M. James Blunt - Bartender New Politics - One of Us Milky Chance - Blossom Wrabel - Bloodstain Sha Leon - Where R U Gonna B? Eric Bellinger - Treat Yourself feat. Wale J.I.D - D/vision feat. EARTHGANG GoldLink - Meditation feat. Jazmine Sullivan & KAYTRANADA Smino - Father Son Holy Smoke Gnash - i could change ur life Charli XCX - Babygirl feat. Uffie Little Mix - Touch feat. Kid Ink Flor - hold on Bush - All the Worlds Within You Bantu - Roll With Me Praything - You'll Be Mine MiC LOWRY - Whiskey Kisses R√∂yksopp - Never Ever feat. Susanne Sundf√∏r (Yotto Remix) Old Dominion - No Such Thing as a Broken Heart Jordan Max - Out of Luck Alyssa Micaela - Clean Break Ryan Griffin - Woulda Left Me Too Zac Brown Band - Real Thing Fleet Foxes - Third of May / ≈ådaigahara Hurray For The Riff Raff - Living In The City Jai Wolf - Like It's Over feat. MNDR (Howle Remix) Mallory Knox - Wired X Ambassadors - Hoping Benjamin Booker - Witness SoMo - Want It Skylar Stecker - Only Want You Pentatonix - Imagine Leon Else - The City Don't Care feat. Oliver Brayton Bowman - PUFF PUFF PASS REMIX feat. Kyle Jorja Smith - Beautiful Little Fools Brenda Mada - House Party Playboi Carti - Lookin feat. Lil Uzi Vert DJ Mustard - Want Her feat. Quavo & YG La'Porsha Renae - Somebody Does Louis Futon - Surreal feat. RKCB Work Drugs - Giving up the FeelingEmbed",,,,,,,,,,,,,,,,,,,,,,,,,,,,,,,,,,,,,,,,,,,,,,,,,,,,,,,,,,,,,,,,,,,,,,,,,,,,,,,,,,,,,,,,,,,,,,,,,,,,,,,,,,,,,,,,,,,,,,,,,,,,,,,,,,,,,,,,,,,,,,,,,,,,,,,,,,,,,,,,,,,,,,,,,,,,,,,,,,,,,,,,,,,,,,,,,,,,,,,,,,,,,,,,,,
Jack Harlow,WHATS POPPIN,hip_hop,"152 ContributorsTranslationsPortugu√™sWHATS POPPIN Lyrics[Chorus] What's poppin'? (Pooh, you a fool for this one) Brand new whip, just hopped in (Just‚ÄÖhopped‚ÄÖin) I got options‚ÄÖ(Oh Lord, Jetson made another one) I‚ÄÖcould pass that bitch like Stockton (It ain't nothin') Just joshin' I'ma spend this holiday locked in (Ooh) My body got rid of them toxins (Mmh, mmh) SportsCenter, top ten  [Verse] I could put the ball in the end zone Put a bad bitch in the friendzone, ooh This shit sound like an intro Jetson, give me that tempo, ooh Told Pooh he a fool with this shit (He a fool) Told her don't let her friends know (Don't) In the 'Ville and I move like a don (Don) Eating fettuccine at Vincenzo's Me and my 'migos got that free smoke On the West Coast, yeah, I'm talking 'bout pre-rolls (Pre-roll) Dark haired bitch and she look like Shego (She do) Hometown hero, feeling myself, can't murder my ego (Can't do it) She heard of my deep stroke She said, ""Babe, does it hurt when I deep throat?"" (It does) Certified freak ho Hang around us and she learnin' my lingo Back then, wasn't worried 'bout me though In the gym tryna work on my free throw Goddamn (Goddamn) Spending money at the club like Sam's (Cha-ching) Yes, ma'am She a lil' freak on cam (Facts) But she don't put this on the 'Gram (Nah) Lil' boys tryna diss on the 'Gram (Ayy) I can't switch on the fam (Bitch) Shit's hot, hit the switch on the fan (Hit that shit) This where my head is (Listen) I feel resentment from every direction Even some homies be wearing expressions I be discouraged from sharing my blessings (Damn) We used to share a connection Now it just feels like it's wearing and stretching I'm getting real sick of taking advice From people that never could stare at reflections (Ooh) Somewhere in there is a lesson Y'all ain't evolvin', it's very depressing I'm at the club with the basketball team Me and the Cardinals are sharing a section (Facts) Gotta cherish the present I'm drinking water and wearing protection Got a career and I'm very invested Some people call it a scary obsession (Ooh, period, but) I like to call it a passion I can't be sitting relaxin' (Nah, I can't) PG, we getting some traction I'm at the venue, it's packed in (Packed out) I'm digging her accent I got a B.B. Simon belt on me And she tryna get it unfastened That's my type of distraction That's my type and she Latin (That's facts, ooh) Got my own flow and I'm 'bout to get a patent Brand new sheets for the bed, they satin (Soft, real soft) Y'all wasn't tuned in back then (Nah) My swag, they keep jackin' (Keep on jackin') I ain't doin' no verse, quit askin' (Quit askin') See Jack Harlow LiveGet tickets as low as $64You might also like[Chorus] What's poppin'? (Pooh, you a fool for this one) Brand new whip, just hopped in (Just hopped in) I got options I could pass that bitch like Stockton (It ain't nothin') Just joshin' I'ma spend this holiday locked in (Ooh) My body got rid of them toxins (Mmh, mmh) SportsCenter, top ten76Embed",,,,,,,,,,,,,,,,,,,,,,,,,,,,,,,,,,,,,,,,,,,,,,,,,,,,,,,,,,,,,,,,,,,,,,,,,,,,,,,,,,,,,,,,,,,,,,,,,,,,,,,,,,,,,,,,,,,,,,,,,,,,,,,,,,,,,,,,,,,,,,,,,,,,,,,,,,,,,,,,,,,,,,,,,,,,,,,,,,,,,,,,,,,,,,,,,,,,,,,,,,,,,,,,,,
Young Thug,Hot (feat. Gunna),hip_hop,"89 ContributorsRanking Page: 50 Best Albums & 50 Best Songs of 2019 LyricsThis is the ranking page for the 2019 Year End Lists. The initial ordering for‚ÄÖalbums‚ÄÖand songs is‚ÄÖbased on the results of an‚ÄÖinitial round of voting‚Äîclick here to learn more.  Do not edit the lyrics of this page. Editing the lyrics will result in penalty boxing. If you would like something changed, annotate, discuss it in the suggestions, post in the thread, or message @BrianErwin.Top 50 Albums:1. Tyler the Creator, IGOR 2. Lana Del Rey, Norman Fucking Rockwell 3. Freddie Gibbs & Madlib, Bandana 4. FKA twigs, MAGDALENE 5. Young Thug, So Much Fun 6. Bille Eilish, WHEN WE FALL ASLEEP, WHERE DO WE GO? 7. Ariana Grande, thank u, next 8. Taylor Swift, Lover 9. DaBaby, Baby On Baby 10. YBN Cordae, The Lost Boy 11. Little Simz, Grey Area 12. Benny The Butcher, The Plugs I Met 13. Vampire Weekend, Father of the Bride 14. Post Malone, Hollywood's Bleeding 15. Rapsody, Eve 16. JPEGMAFIA, All My Heroes Are Cornballs 17. Clairo, Immunity 18. Solange, When I Get Home 19. Denzel Curry, ZUU 20. 21 Savage, i am > i was 21. Lizzo, Cuz I Love You 22. EARTHGANG, Mirrorland 23. Charli XCX, Charli 24. Danny Brown, uknowhatimsayin¬ø 25. Polo G, Die A Legend 26. BROCKHAMPTON, Ginger 27. Dave, PSYCHODRAMA 28. Anderson .Paak, Ventura 29. BTS, Map Of The Soul: Persona 30. Maggie Rogers, Heard It in a Past Life 31. Bon Iver, i, I 32. Teejayx6, Under Pressure 33. Jamila Woods, Legacy! Legacy! 34. clipping., There Existed An Addiction to Blood 35. Dreamville Records, Revenge of the Dreamers III 36. Skepta, Ignorance Is Bliss 37. James Blake, Assume Form 38. Weyes Blood, Titanic Rising 39. NF, The Search 40. Megan Thee Stallion, Fever 41. slowthai, Nothing Great About Britain 42. Bad Bunny, X 100pre 43. nobigdyl., LOWERCASE TAPE. 44. Rich Brian, The Sailor 45. Kano, Hoodies All Summer 46. Caroline Polachek, Pang 47. Zico, Thinking 48. Summer Walker, Over It 49. PNL, Deux fr√®res 50. 2 Chainz, Rap Or Go To The LeagueNotable albums that didn't make the list:Snoh Aalegra, Ugh, Those Feels Again Key!, So Emotional YNW Melly, Melly vs. Melvin Ari Lennox, Shea Butter Baby A Boogie Wit da Hoodie, Hoodie SZN IDK, Is He RealNotable albums released post-voting & pre-December 10:Album Graveyard:Chris Brown, Indigo Kanye West, Jesus Is King Willow Smith, WILLOW Doja Cat, Hot Pink Kevin Abstract, ARIZONA BABY Sabrina Carpenter, Singular: Act II Ed Sheeran, No. 6 Collaborations Project FINNEAS, Blood Harmony EP Jaden, ERYS Offset, Father of 4 Maxo Kream, Brandon Banks Carly Rae Jepsen, Dedicated blink-182, Nine Colde, Love Part 1 Future, Future Hndrxxx Presents: The WIZRD Yungblud, The Underrated Youth - EPTop 50 Songs:1. Lil Nas X, ‚ÄúOld Town Road (Remix)‚Äù feat. Billy Ray Cyrus 2. FKA Twigs, ‚ÄúCellophane‚Äù 3. Billie Eilish, ""bad guy"" 4. Denzel Curry, ""RICKY"" 5. DaBaby, ""Suge"" 6. Tyler, The Creator, ‚ÄúEARFQUAKE‚Äù 7. 21 Savage, ""a lot"" feat. J. Cole 8. Megan Thee Stallion, ""Hot Girl Summer"" feat Nicki Minaj & Ty Dolla $ign 9. Young Thug, ""Hot"" feat. Gunna 10. Solange, ""almeda"" feat. Playboi Carti & The Dream 11. Freddie Gibbs & Madlib, ""Crime Pays"" 12. Benny The Butcher, ""Crown For Kings"" feat. Black Thought 13. DaBaby, ""INTRO"" 14. J. Cole, ""Middle Child"" 15. Lana Del Rey, ""Norman fucking Rockwell"" 16. Taylor Swift, ‚ÄúLover‚Äù 17. Polo G, ""Pop Out"" feat. Lil Tjay 18. Lizzo, ‚ÄúJuice‚Äù 19. Lil Tecca, ""Ransom"" 20. Koffee, ""Rapture"" 21. Clairo, ‚ÄúBags‚Äù 22. Ariana Grande - ""break up with your girlfriend, i'm bored"" 23. Young Thug, ""The London"" feat. J. Cole and Travis Scott 24. YBN Cordae, ""Broke As Fuck"" 25. Dreamville, Earthgang and J. Cole, ""Sacrifices"" feat. Smino & Saba 26. SiR, ‚ÄúHair Down‚Äù feat. Kendrick Lamar 27. Danny Brown, ""Best Life"" 28. BTS, ""Boy With Luv"" feat. Halsey 29. Drake, ""Money In The Grave"" feat. Rick Ross 30. Pop Smoke, ""Welcome To The Party"" 31. Post Malone, ""Take What You Want"" feat. Travis Scott & Ozzy Osbourne 32. AKMU, ""How can I love the heartbreak, you're the one i love"" 33. BROCKHAMPTON, ""NO HALO"" 34. Kanye West, ""Use This Gospel"" 35. Stormzy, ""Wiley Flow"" 36. ROSAL√çA & J Balvin, ‚ÄúCon Altura‚Äù feat. El Guincho 37. Lil Uzi Vert, ""Sanguine Paradise"" 38. Lana Del Rey, ""Doin' Time"" 39. BLACKPINK, ""Kill This Love"" 40. Injury Reserve, ""Jailbreak the Tesla"" feat. Amin√© 41. A$AP Rocky, ""Babushka Boi"" 42. Teejayx6, ""Swipe Story"" 43. Juice WRLD & YoungBoy Never Broke Again, ""Bandit"" 44. NF, ""The Search"" 45. Lil Gotit, ""Da Real Hoodbabies"" 46. Vampire Weekend, ""Flower Moon"" 47. Skillet, ‚ÄúSave Me‚Äù 48. Lil Keed, ""Pull Up"" feat. Lil Uzi Vert & YNW Melly 49. Baekhyun, ""UN Village"" 50. Charli XCX, ""Gone"" feat. Christine and the QueensNotable songs that didn't make the list:Freddie Gibbs & Madlib - ""Palmolive"" feat. Pusha T & Killer Mike Pusha T, ""Coming Home"" feat. Lauryn Hill Lana Del Rey, ""hope is a dangerous thing for a woman like me to have - but i have it"" Ariana Grande - ""7 rings"" 645AR - ""Bible and a K"" Bad Bunny - ""Calla√≠ta"" Baby Keem - ""ORANGE SODA"" YNW Melly - ""223's"" feat. 9LOKKNINE FKA twigs, ‚Äúhome with you‚Äù FKA twigs, ‚Äúholy terrain‚Äù feat. Future Post Malone, ""Circles"" NF, ‚ÄúReturns‚Äù YBN Cordae, ""Have Mercy"" NF, ""Hate Myself"" Snoh Aalegra, ‚ÄúNothing To Me‚ÄùNotable songs released post-voting & pre-December 10:The Weeknd, ""Blinding Lights""Song Graveyard:Lizzo, ‚ÄúTruth Hurts‚Äù Nipsey Hussle, ""Racks In The Middle"" feat. Roddy Ricch & Hit-Boy Mustard feat. Roddy Ricch, ""Ballin'"" Afro B ""Drogba (Joanna)"" Danny Brown, ‚ÄúDirty Laundry‚Äù Post Malone, ""Die For Me"" feat. Future & Halsey YNW Melly - ""Murder On My Mind"" Ed Sheeran, ""Take Me Back To London"" feat. Stormzy PNL, ""Au DD"" Dua Lipa, ""Don't Start Now"" Chris Brown, ""No Guidance"" feat. Drake Steve Malcolm, ""Summertime"" feat. Jayway Ruel, ‚ÄúFree Time‚Äù Travis Scott, ""Highest In The Room"" Lewis Capaldi ""Someone You Loved""3Embed",,,,,,,,,,,,,,,,,,,,,,,,,,,,,,,,,,,,,,,,,,,,,,,,,,,,,,,,,,,,,,,,,,,,,,,,,,,,,,,,,,,,,,,,,,,,,,,,,,,,,,,,,,,,,,,,,,,,,,,,,,,,,,,,,,,,,,,,,,,,,,,,,,,,,,,,,,,,,,,,,,,,,,,,,,,,,,,,,,,,,,,,,,,,,,,,,,,,,,,,,,,,,,,,,,
