artist_name,track_name,genre,lyrics,,,,,,,,,,,,,,,,,,,,,,,,,,,,,,,,,,,,,,,,,,,,,,,,,,,,,,,,,,,,,,,,,,,,,,,,,,,,,,,,,,,,,,,,,,,,,,,,,,,,,,,,,,,,,,,,,,,,,,,,,,,,,,,,,,,,,,,,,,,,,,,,,,,,,,,,,,,,,,,,,,,,,,,,,,,,,,,,,,,,,,,,,,,,,,,,,,,,,,,,,,,,,,,,,,
Kendrick Lamar,Alright,hip_hop,"528 ContributorsTranslationsFran√ßaisEspa√±olPolski–†—É—Å—Å–∫–∏–πPortugu√™sSvenskaAlright Lyrics[Produced by Pharrell Williams & Sounwave] [Directed by Colin Tilley] [Intro: Kendrick Lamar] Alls my life, I has to fight, nigga Alls my life, I‚Äî Hard times like, ""Yah"" Bad trips like, ""Yah"" Nazareth I'm fucked up, homie, you fucked up But if God got us, then we gon' be alright [Chorus: Pharrell Williams] Nigga, we gon' be alright Nigga, we gon' be alright We gon' be alright Do you hear me, do you feel me? We gon' be alright Nigga, we gon' be alright Huh? We gon' be alright Nigga, we gon' be alright Do you hear me, do you feel me? We gon' be alright [Verse 1: Kendrick Lamar] Uh, and when I wake up I recognize you're looking at me for the pay cut But homicide be looking at you from the face down What MAC-11 even boom with the bass down? Schemin', and let me tell you 'bout my life Painkillers only put me in the twilight Where pretty pussy and Benjamin is the highlight Now tell my mama I love her, but this what I like, Lord knows Twenty of 'em in my Chevy, tell 'em all to come and get me Reapin' everything I sow, so my karma comin' heavy No preliminary hearings on my record I'm a motherfuckin' gangster in silence for the record, uh Tell the world I know it's too late Boys and girls, I think I've gone cray Drown inside my vices all day Won't you please believe when I say You might also like[Pre-Chorus: Kendrick Lamar] Wouldn't you know We been hurt, been down before, nigga When our pride was low Lookin' at the world like, ""Where do we go?"" Nigga And we hate po-po Wanna kill us dead in the street for sure, nigga I'm at the preacher's door My knees gettin' weak and my gun might blow But we gon' be alright [Chorus: Pharrell Williams] Nigga, we gon' be alright Nigga, we gon' be alright We gon' be alright Do you hear me, do you feel me? We gon' be alright Nigga, we gon' be alright Huh? We gon' be alright Nigga, we gon' be alright Do you hear me, do you feel me? We gon' be alright [Verse 2: Kendrick Lamar] What you want you, a house‚Å†? You, a car? Forty acres and a mule? A piano, a guitar? Anything, see my name is Lucy, I'm your dog Motherfucker, you can live at the mall I can see the evil, I can tell it, I know it's illegal I don't think about it, I deposit every other zero Thinkin' of my partner, put the candy paintin' on the Regal Diggin' in my pocket, ain't a profit big enough to feed you Every day, my logic get another dollar just to keep you In the presence of your chico, ah I don't talk about it, be about it, every day, I sequel If I got it, then you know you got it, Heaven, I can reach you Pat Dawg, Pat Dawg, Pat Dawg, my dog, that's all Bick back and Chad, I trap the bag for y'all I rap, I black on track, so rest assured My rights, my wrongs, I write 'til I'm right with God [Pre-Chorus: Kendrick Lamar] Wouldn't you know We been hurt, been down before, nigga When our pride was low Lookin' at the world like, ""Where do we go?"" Nigga And we hate po-po Wanna kill us dead in the street for sure, nigga I'm at the preacher's door My knees gettin' weak, and my gun might blow But we gon' be alright [Chorus: Pharrell Williams] Nigga, we gon' be alright Nigga, we gon' be alright We gon' be alright Do you hear me, do you feel me? We gon' be alright Nigga, we gon' be alright Huh? We gon' be alright Nigga, we gon' be alright Do you hear me, do you feel me? We gon' be alright  [Outro: Kendrick Lamar & Thundercat] I keep my head up high I cross my heart and hope to die Lovin' me is complicated Too afraid of a lot of changes I'm alright, and you're a favorite Dark nights in my prayers [Poem: Kendrick Lamar] I remembered you was conflicted Misusing your influence, sometimes I did the same Abusing my power, full of resentment Resentment that turned into a deep depression Found myself screamin' in the hotel room I didn't wanna self-destruct The evils of Lucy was all around me So I went runnin' for answers781Embed",,,,,,,,,,,,,,,,,,,,,,,,,,,,,,,,,,,,,,,,,,,,,,,,,,,,,,,,,,,,,,,,,,,,,,,,,,,,,,,,,,,,,,,,,,,,,,,,,,,,,,,,,,,,,,,,,,,,,,,,,,,,,,,,,,,,,,,,,,,,,,,,,,,,,,,,,,,,,,,,,,,,,,,,,,,,,,,,,,,,,,,,,,,,,,,,,,,,,,,,,,,,,,,,,,
Cardi B,Bodak Yellow,hip_hop,"423 ContributorsTranslationsEspa√±olFran√ßaisNederlandsBodak Yellow Lyrics[Intro] KSR It's Cardi, ayy Said I'm the shit, they can't fuck with me if they wanted to I don't gotta dance  [Chorus] Said, ""Lil' bitch, you can't fuck with me if you wanted to"" These expensive, these is red bottoms, these is bloody shoes Hit the store, I can get 'em both, I don't wanna choose And I'm quick, cut a nigga off, so don't get comfortable, look I don't dance now, I make money moves (Ayy, ayy) Say I don't gotta dance, I make money move If I see you and I don't speak, that means I don't fuck with you I'm a boss, you a worker, bitch, I make bloody moves  [Verse 1] Now she say she gon' do what to who? Let's find out and see Cardi B, you know where I'm at, you know where I be You in the club just to party, I'm there, I get paid a fee I be in and out them banks so much, I know they're tired of me Honestly, don't give a fuck 'bout who ain't fond of me Dropped two mixtapes in six months What bitch working as hard as me? I don't bother with these hoes, don't let these hoes bother me They see pictures, they say, ""Goals,"" bitch, I'm who they tryna be Look, I might just chill in some BAPE I might just chill with your boo, I might just feel on your babe My pussy feel like a lake He wanna swim with his face, I'm like, ""Okay"" I'll let him get what he want, he buy me Yves Saint Laurent And the new whip, when I go fast as a horse I got the trunk in the front (Vroom, vroom) I'm the hottest in the street, know you prolly heard of me Got a bag and fixed my teeth, hope you hoes know it ain't cheap And I pay my mama bills, I ain't got no time to chill Think these hoes be mad at me, their baby father run a bill You might also like[Chorus] Said, ""Lil' bitch, you can't fuck with me if you wanted to"" These expensive, these is red bottoms, these is bloody shoes Hit the store, I can get 'em both, I don't wanna choose And I'm quick, cut a nigga off, so don't get comfortable, look I don't dance now, I make money moves Say I don't gotta dance, I make money moves If I see you and I don't speak, that means I don't fuck with you I'm a boss, you a worker, bitch, I make bloody moves  [Verse 2] If you a pussy, you get popped, you a goofy, you a opp Don't you come around my way, you can't hang around my block And I just checked my accounts, turns out, I'm rich, I'm rich, I'm rich I put my hand above my hip, I bet you dip, he dip, she dip I say I get the money and go, this shit is hot like a stove My pussy glitter is gold, tell that lil' bitch play her role I just arrove in a Rolls, I just came up in a Wraith I need to fill up the tank, no, I need to fill up the safe I need to let all these hoes know that none of their niggas is safe I go to dinner and steak, only the real can relate I used to live in the P's, now it's a crib with a gate Rollie got charms, look like Frosted Flakes Had to let these bitches know, just in case these hoes forgot I just run and check the mail, another check from Mona Scott [Chorus] Said, ""Lil' bitch, you can't fuck with me if you wanted to"" These expensive, these is red bottoms, these is bloody shoes Hit the store, I can get 'em both, I don't wanna choose And I'm quick, cut a nigga off, so don't get comfortable, look I don't dance now, I make money moves Say I don't gotta dance, I make money move If I see you and I don't speak, that means I don't fuck with you I'm a boss, you a worker, bitch, I make bloody moves307Embed",,,,,,,,,,,,,,,,,,,,,,,,,,,,,,,,,,,,,,,,,,,,,,,,,,,,,,,,,,,,,,,,,,,,,,,,,,,,,,,,,,,,,,,,,,,,,,,,,,,,,,,,,,,,,,,,,,,,,,,,,,,,,,,,,,,,,,,,,,,,,,,,,,,,,,,,,,,,,,,,,,,,,,,,,,,,,,,,,,,,,,,,,,,,,,,,,,,,,,,,,,,,,,,,,,
Drake,God's Plan,hip_hop,"671 ContributorsTranslations–†—É—Å—Å–∫–∏–πT√ºrk√ßeEspa√±olPolskiItalianoDeutschFran√ßaisAz…ôrbaycanca / ÿ¢ÿ∞ÿ±ÿ®ÿßŸäÿ¨ÿßŸÜGod‚Äôs Plan Lyrics[Intro] And they wishin' and wishin' And wishin' and wishin', they wishin' on me Yeah  [Verse 1] I been movin' calm, don't start no trouble with me Tryna keep it peaceful is a struggle for me Don't pull up at 6 a.m. to cuddle with me You know how I like it when you lovin' on me I don't wanna die for them to miss me Yes, I see the things that they wishin' on me Hope I got some brothers that outlive me They gon' tell the story, shit was different with me  [Chorus] God's plan, God's plan I hold back, sometimes I won't, yeah I feel good, sometimes I don't (Ayy, don't) I finessed down Weston Road (Ayy, 'nessed) Might go down a G-O-D (Yeah, wait) I go hard on Southside G (Yeah, wait) I make sure that north-side eat And still  [Post-Chorus] Bad things It's a lot of bad things that they wishin' and wishin' And wishin' and wishin', they wishin' on me Bad things It's a lot of bad things that they wishin' and wishin' And wishin' and wishin', they wishin' on me Yeah, ayy, ayy You might also like[Verse 2] She say, ""Do you love me?"" I tell her, ""Only partly I only love my bed and my mama, I'm sorry"" Fifty Dub, I even got it tatted on me Eighty-one, they'll bring the crashers to the party And you know me Turn the O2 into the O3, dog Without 40, Oli, there'd be no me 'Magine if I never met the broskies  [Chorus] God's plan, God's plan I can't do this on my own, ayy (No, ayy) Someone watchin' this shit close (Yep, close) I've been me since Scarlett Road, ayy (Road, ayy) Might go down as G-O-D (Yeah, wait, yeah) I go hard on Southside G (Ayy, wait, ayy) I make sure that north-side eat, yeah And still  [Post-Chorus] Bad things It's a lot of bad things that they wishin' and wishin' And wishin' and wishin', they wishin' on me Yeah, yeah Bad things It's a lot of bad things that they wishin' and wishin' And wishin' and wishin', they wishin' on me Yeah942Embed",,,,,,,,,,,,,,,,,,,,,,,,,,,,,,,,,,,,,,,,,,,,,,,,,,,,,,,,,,,,,,,,,,,,,,,,,,,,,,,,,,,,,,,,,,,,,,,,,,,,,,,,,,,,,,,,,,,,,,,,,,,,,,,,,,,,,,,,,,,,,,,,,,,,,,,,,,,,,,,,,,,,,,,,,,,,,,,,,,,,,,,,,,,,,,,,,,,,,,,,,,,,,,,,,,
Lil Uzi Vert,XO Tour Llif3,hip_hop,"[Intro] Are you alright? I'm alright, I'm quite alright And my money's right 8 (Yeah) Countin' them bands All way to the top 'til they be fallin' over (Yeah, yeah, yeah) Countin' them bands On my way to the top 'til we fallin' over [Chorus] I don't really care if you cry On the real, you should've never lied Should've saw the way she looked me in my eyes She said, ""Baby, I am not afraid to die"" Push me to the edge All my friends are dead Push me to the edge All my friends are dead Push me to the edge All my friends are dead Push me to the edge [Verse 1] Phantom that's all red, inside all white Like somethin' you ride a sled down, I just want that head My Brittany got mad, I'm barely her man now Everybody got the same swag now Watch the way that I tear it down Stackin' my bands all the way to the top All the way 'til my bands fallin' over Every time that you leave your spot Your girlfriend call me like, ""Come on over!"" I like the way that she treat me Gon' leave you, won't leave me, I call it that Casanova She say I'm insane, yeah Wanna blow my brain out (Hey) Xanny, help the pain, yeah Please, Xanny, make it go away I'm committed, not addicted, but it keep control of me All the pain, now I can't feel it I swear that it's slowin' me, yeah [Chorus] I don't really care if you cry On the real, you should've never lied Saw the way she looked me in my eyes She said, ""I am not afraid to die"" (Yeah) All my friends are dead Push me to the edge (Yeah) All my friends are dead, yeah, ooh Push me to the edge All my friends are dead, yeah All my friends are dead, yeah [Verse 2] That is not your swag, I swear you fake hard Now these niggas wanna take my cadence (Yeah) Rain on 'em, thunderstorm, rain on 'em (Ooh, yeah) Make some, lil' nigga, take some (Yeah, yeah) Fast car, NASCAR, race on 'em In the club, ain't got no ones, then we would become (Yeah) Clothes from overseas, got the racks and they all C-Notes You is not a G though Lookin' at you stackin' all your money, it all green though I was countin' that and these all twenties, that's a G-roll [Bridge] She say, ""You're the worst, you're the worst"" I cannot die because this my universe [Chorus] I don't really care if you cry On the real, you should've never lied Should've saw the way she looked me in my eyes She said, ""Baby, I am not afraid to die"" Push me to the edge All my friends are dead Push me to the edge All my friends are dead Push me to the edge All my friends are dead Push me to the edge",,,,,,,,,,,,,,,,,,,,,,,,,,,,,,,,,,,,,,,,,,,,,,,,,,,,,,,,,,,,,,,,,,,,,,,,,,,,,,,,,,,,,,,,,,,,,,,,,,,,,,,,,,,,,,,,,,,,,,,,,,,,,,,,,,,,,,,,,,,,,,,,,,,,,,,,,,,,,,,,,,,,,,,,,,,,,,,,,,,,,,,,,,,,,,,,,,,,,,,,,,,,,,,,,,
Future,March Madness,hip_hop,"160 ContributorsMarch Madness Lyrics[Intro] Dress it up and make it real for me Hahaha Whatever that fuckin' mean (808 Mafia)  [Chorus] Dirty soda in a Styrofoam (Yee) Spend a day to get my mind blown (Mind blown) Dress it up and go to NASA (Yeah) Two hundred miles on the dash (Woo) Gotta roll a pound up and gas it (Swear) Switchin' lanes in a Grand Rapid (Switch) We the ones that kept it cool with all these niggas 'Til these niggas started actin' (We did it) Shoot a nigga like a film, made a movie Nigga, go'n let 'em have it (We did) We ballin' like the March Madness (Yeah) All these cops shootin' a nigga, tragic (Boom) I'm the one that's livin' lavish (I'm the one) Like I'm playin' for the Mavericks (Ballin') I didn't wanna fuck the bitch (Woo) The molly made me fuck her even though she average  [Verse 1] Dirty muddy in the cup (Cup) The .45 by my gut My young nigga in the cut (Swear) Take you out for some Jordans (Pluto) Let's count this money, no rushin' (Freebandz) I'm on a one way flushin' (Flushin') Loud pack smellin' musty (Musty) These fuckin' police can't touch me (Nah) These bogus police can't touch me (Nah) These fuckin' niggas can't touch me (Freeband Gang) Apply the pressure with the VVS (Yeah, yeah) I drive the foreign like it was a Chevy (Woo) Drive the foreign like it was a Chevy (Skrrt) Lift it up and go'n and offset it (Pluto) Fuck a cougar like she Halle Berry (Pluto) Future Hendrix, Dirty Sprite, legendary (Dirty Sprite) You might also like[Chorus] Dirty soda in a Styrofoam (Yee) Spend a day to get my mind blown (Mind blown) Dress it up and go to NASA (Yeah) Two hundred miles on the dash (Woo) Gotta roll a pound up and gas it (Swear) Switchin' lanes in a Grand Rapid (Switch) We the ones that kept it cool with all these niggas 'Til these niggas started actin' (We did it) Shoot a nigga like a film, made a movie Nigga, go'n let 'em have it (We did) We ballin' like the March Madness (Yeah) All these cops shootin' a nigga, tragic (Boom) I'm the one that's livin' lavish (I'm the one) Like I'm playin' for the Mavericks (Ballin') I didn't wanna fuck the bitch (Woo) The molly made me fuck her even though she average  [Verse 2] Fuck on a basic bitch We gon' wake up and smoke us a blunt and fuck She gon' keep it so real with a nigga that I'ma come back and always gon' fuck with her Bend the curve in a Spur like a MARTA bus I was workin' and servin' in Nautica (Yeah) I get high 'til I'm higher than Mercury (High) Fuck around, teach you that recipe (Yeah, yeah) Fuck around, you gon' be out of here (Out of here) Make her say, ""Huh,"" like a nigga was Juvie Soon as that work hit the city, we move it Post up in Onyx and shoot us a movie Post up in Onyx and shoot us a movie (Movie) Take the tool inside the club and just in case a nigga ever gotta use it (Future) Get a pint of codeine, pour it up, nigga (Pour it up, nigga) [Chorus] Dirty soda in a Styrofoam (Yee) Spend a day to get my mind blown (Mind blown) Dress it up and go to NASA (Yeah) Two hundred miles on the dash (Woo) Gotta roll a pound up and gas it (Swear) Switchin' lanes in a Grand Rapid (Switch) We the ones that kept it cool with all these niggas 'Til these niggas started actin' (We did it) Shoot a nigga like a film, made a movie Nigga, go'n let 'em have it (We did) We ballin' like the March Madness (Yeah) All these cops shootin' a nigga, tragic (Boom) I'm the one that's livin' lavish (I'm the one) Like I'm playin' for the Mavericks (Ballin') I didn't wanna fuck the bitch (Woo) The molly made me fuck her even though she average  [Bridge] These bogus police can't touch me These fuckin' niggas can't touch me Apply the pressure with the VVS I drive the foreign like it was a Chevy Drive the foreign like it was a Chevy Lift it up and go'n and offset it Fuck a cougar like she Halle Berry Future Hendrix, Dirty Sprite, legendary [Chorus] Dirty soda in a Styrofoam (Yee) Spend a day to get my mind blown (Mind blown) Dress it up and go to NASA (Yeah) Two hundred miles on the dash (Woo) Gotta roll a pound up and gas it (Swear) Switchin' lanes in a Grand Rapid (Switch) We the ones that kept it cool with all these niggas 'Til these niggas started actin' (We did it) Shoot a nigga like a film, made a movie Nigga, go'n let 'em have it (We did) We ballin' like the March Madness (Yeah) All these cops shootin' a nigga, tragic (Boom) I'm the one that's livin' lavish (I'm the one) Like I'm playin' for the Mavericks (Ballin') I didn't wanna fuck the bitch (Woo) The molly made me fuck her even though she average169Embed",,,,,,,,,,,,,,,,,,,,,,,,,,,,,,,,,,,,,,,,,,,,,,,,,,,,,,,,,,,,,,,,,,,,,,,,,,,,,,,,,,,,,,,,,,,,,,,,,,,,,,,,,,,,,,,,,,,,,,,,,,,,,,,,,,,,,,,,,,,,,,,,,,,,,,,,,,,,,,,,,,,,,,,,,,,,,,,,,,,,,,,,,,,,,,,,,,,,,,,,,,,,,,,,,,
